J,"Skinner, KE; Fernandes, AW; Walker, MS; Pavilack, M; VanderWalde, A",,,,"Skinner, Karen E.; Fernandes, Ancilla W.; Walker, Mark S.; Pavilack, Melissa; VanderWalde, Ari",,,Healthcare costs in patients with advanced non-small cell lung cancer and disease progression during targeted therapy: a real-world observational study,JOURNAL OF MEDICAL ECONOMICS,,,English,Article,,,,,,Advanced NSCLC; community oncology; healthcare resource utilization; cost,PHASE-III; 1ST-LINE TREATMENT; OPEN-LABEL; CHEMOTHERAPY; ADENOCARCINOMA; AFATINIB; GEFITINIB; TRIAL; MULTICENTER; CARBOPLATIN,"Aims: To assess healthcare costs during treatment with epidermal growth factor receptor (EGFR) tyrosine kinase inhibitors (TKIs) and following disease progression in patients with advanced non-small cell lung cancer (NSCLC). Methods: A retrospective analysis of medical records of US community oncology practices was conducted. Eligible patients had advanced NSCLC (stage IIIB/IV) diagnosed between January 1, 2008 and January 1, 2015, initiated treatment with erlotinib or afatinib (first-line or second-line), and had disease progression. Monthly Medicare-paid costs were evaluated during the TKI therapy period and following progression. Results: The study included 364 patients. The total mean monthly cost during TKI therapy was $20,106 (95% confidence interval [CI]=$16,836-$23,376), of which 47.0% and 42.4% represented hospitalization costs and anti-cancer therapy costs, respectively. Following progression on TKI therapy (data available for 316 patients), total mean monthly cost was $19,274 (95% CI=$15,329-$23,218), and was higher in the 76.3% of patients who received anti-cancer therapy following progression than in the 23.7% of those who did not ($20,490 vs $15,364; p<.001). Among patients who received it, anti-cancer therapy ($11,198; 95% CI=$7,102-$15,295) represented 54.7% of total mean monthly cost. Among patients who did not receive anti-cancer therapy, hospitalization ($13,829; 95% CI=$4,922-$22,736) represented 90.0% of total mean monthly cost. Impaired performance status and brain metastases were significant predictors of increased cost during TKI therapy. Limitations: The study design may limit the generalizability of findings. Conclusions: Healthcare costs during TKI treatment and following progression appeared to be similar and were largely attributed to hospitalization and anti-cancer therapy. Notably, almost one-quarter of patients did not receive anti-cancer therapy following progression, potentially indicating an unmet need; hospitalization was the largest cost contributor for these patients. Additional effective targeted therapies are needed that could prolong progression-free survival, leading to fewer hospitalizations for EGFR mutation-positive patients.","[Skinner, Karen E.; Walker, Mark S.] Vector Oncol, 6555 Quince,Suite 400, Memphis, TN 38119 USA; [Fernandes, Ancilla W.; Pavilack, Melissa] AstraZeneca, Gaithersburg, MD USA; [VanderWalde, Ari] West Canc Ctr, Memphis, TN USA",AstraZeneca,"Skinner, KE (通讯作者)，Vector Oncol, 6555 Quince,Suite 400, Memphis, TN 38119 USA.",kskinner@vectoroncology.com,"VanderWalde, Ari/HLQ-7510-2023",,AstraZeneca,AstraZeneca(AstraZeneca),The study was funded by AstraZeneca.,,30,28,29,0,1,TAYLOR & FRANCIS LTD,ABINGDON,"2-4 PARK SQUARE, MILTON PARK, ABINGDON OR14 4RN, OXON, ENGLAND",1369-6998,1941-837X,,J MED ECON,J. Med. Econ.,,2018,21,2.0,,,,,192,200,,10.1080/13696998.2017.1389744,0,,,9,"Economics; Health Care Sciences & Services; Health Policy & Services; Medicine, General & Internal",Science Citation Index Expanded (SCI-EXPANDED),Business & Economics; Health Care Sciences & Services; General & Internal Medicine,FT8RT,29041833.0,Bronze,,,2024-03-08,WOS:000423421600011,0
J,"Helveston, JP; Feit, EM; Michalek, JJ",,,,"Helveston, John Paul; Feit, Elea McDonnell; Michalek, Jeremy J.",,,Pooling stated and revealed preference data in the presence of RP endogeneity,TRANSPORTATION RESEARCH PART B-METHODOLOGICAL,,,English,Article,,,,,,Endogeneity; Discrete choice modeling; Data enrichment; Choice data combination; Pooled models; Revealed preference; Stated preference; Stated choice,WILLINGNESS-TO-PAY; HYPOTHETICAL BIAS; MODELS; QUALITY,"Pooled discrete choice models combine revealed preference (RP) data and stated preference (SP) data to exploit advantages of each. SP data is often treated with suspicion because consumers may respond differently in a hypothetical survey context than they do in the marketplace. However, models built on RP data can suffer from endogeneity bias when attributes that drive consumer choices are unobserved by the modeler and correlated with observed variables. Using a synthetic data experiment, we test the performance of pooled RP-SP models in recovering the preference parameters that generated the market data under conditions that choice modelers are likely to face, including (1) when there is potential for endogeneity problems in the RP' data, such as omitted variable bias, and (2) when consumer willingness to pay for attributes may differ from the survey context to the market context. We identify situations where pooling RP and SP data does and does not mitigate each data source's respective weaknesses. We also show that the likelihood ratio test, which has been widely used to determine whether pooling is statistically justifiable, (1) can fail to identify the case where SP context preference differences and RP endogeneity bias shift the parameter estimates of both models in the same direction and magnitude and (2) is unreliable when the product attributes are fixed within a small number of choice sets, which is typical of automotive RP data. Our findings offer new insights into when pooling data sources may or may not be advisable for accurately estimating market preference parameters, including consideration of the conditions and context under which the data were generated as well as the relative balance of information between data sources. (C) 2018 Elsevier Ltd. All rights reserved.","[Helveston, John Paul] Boston Univ, Inst Sustainable Energy, 595 Commonwealth Ave, Boston, MA 02215 USA; [Feit, Elea McDonnell] Drexel Univ, LeBow Coll Business, 3220 Market St, Philadelphia, PA 19104 USA; [Michalek, Jeremy J.] Carnegie Mellon Univ, Dept Mech Engn, 5000 Forbes Ave, Pittsburgh, PA 15213 USA; [Michalek, Jeremy J.] Carnegie Mellon Univ, Dept Engn & Publ Policy, 5000 Forbes Ave, Pittsburgh, PA 15213 USA",Boston University; Drexel University; Carnegie Mellon University; Carnegie Mellon University,"Helveston, JP (通讯作者)，Boston Univ, Inst Sustainable Energy, 595 Commonwealth Ave, Boston, MA 02215 USA.",jhelvy@bu.edu; efeit@drexel.edu; jmichalek@cmu.edu,"Helveston, John/AAL-2571-2020; Feit, Elea McDonnell/L-6621-2018","Helveston, John/0000-0002-2657-9191; Feit, Elea McDonnell/0000-0002-1067-0791","Link Foundation; National Science Foundation [1064241]; Ford Motor Company; SBE Off Of Multidisciplinary Activities; Direct For Social, Behav & Economic Scie [1064241] Funding Source: National Science Foundation","Link Foundation; National Science Foundation(National Science Foundation (NSF)); Ford Motor Company; SBE Off Of Multidisciplinary Activities; Direct For Social, Behav & Economic Scie(National Science Foundation (NSF)NSF - Directorate for Social, Behavioral & Economic Sciences (SBE))","The authors would like to thank the three reviewers who provided excellent feedback that improved the study. This work was supported in part by a grant from the Link Foundation, a grant from the National Science Foundation #1064241, and a grant from Ford Motor Company. The opinions expressed are those of the authors and not necessarily those of the sponsors.",,47,17,18,1,19,PERGAMON-ELSEVIER SCIENCE LTD,OXFORD,"THE BOULEVARD, LANGFORD LANE, KIDLINGTON, OXFORD OX5 1GB, ENGLAND",0191-2615,1879-2367,,TRANSPORT RES B-METH,Transp. Res. Pt. B-Methodol.,MAR,2018,109,,,,,,70,89,,10.1016/j.trb.2018.01.010,0,,,20,"Economics; Engineering, Civil; Operations Research & Management Science; Transportation; Transportation Science & Technology",Science Citation Index Expanded (SCI-EXPANDED); Social Science Citation Index (SSCI),Business & Economics; Engineering; Operations Research & Management Science; Transportation,FZ1JG,,hybrid,,,2024-03-08,WOS:000427332300004,0
J,"Kay, G; Eby, EL; Brown, B; Lyon, J; Eggington, S; Kumar, G; Fenwick, E; Sohail, MR; Wright, DJ",,,,"Kay, Gemma; Eby, Elizabeth L.; Brown, Benedict; Lyon, Julie; Eggington, Simon; Kumar, Gayathri; Fenwick, Elisabeth; Sohail, M. Rizwan; Wright, David Jay",,,Cost-effectiveness of TYRX absorbable antibacterial envelope for prevention of cardiovascular implantable electronic device infection,JOURNAL OF MEDICAL ECONOMICS,,,English,Article,,,,,,Cost-effectiveness; cardiovascular implantable electronic device; infection; antibacterial envelope,PACEMAKER IMPLANTATION; HEALTH; ASSOCIATION; MANAGEMENT; CARE,"Aims: Infection is a major complication of cardiovascular implantable electronic device (CIED) therapy that usually requires device extraction and is associated with increased morbidity and mortality. The TYRX Antibacterial Envelope is a polypropylene mesh that stabilizes the CIED and elutes minocycline and rifampin to reduce the risk of post-operative infection. Methods: A decision tree was developed to assess the cost-effectiveness of TYRX vs standard of care (SOC) following implantation of four CIED device types. The model was parameterized for a UK National Health Service perspective. Probabilities were derived from the literature. Resource use included drug acquisition and administration, hospitalization, adverse events, device extraction, and replacement. Incremental cost-effectiveness ratios (ICERs) were calculated from costs and quality-adjusted life-years (QALYs). Results: Over a 12-month time horizon, TYRX was less costly and more effective than SOC when utilized in patients with an ICD or CRT-D. TYRX was associated with ICERs of 46,548 and 21,768 pound per QALY gained in patients with an IPG or CRT-P, respectively. TYRX was cost-effective at a 30,000 pound threshold at baseline probabilities of infection exceeding 1.65% (CRT-D), 1.95% (CRT-P), 1.87% (IPG), and 1.38% (ICD). Limitations and conclusions: Device-specific infection rates for high-risk patients were not available in the literature and not used in this analysis, potentially under-estimating the impact of TYRX in certain devices. Nevertheless, TYRX is associated with a reduction in post-operative infection risk relative to SOC, resulting in reduced healthcare resource utilization at an initial cost. The ICERs are below the accepted willingness-to-pay thresholds used by UK decision-makers. TYRX, therefore, represents a cost-effective prevention option for CIED patients at high-risk of post-operative infection.","[Kay, Gemma; Kumar, Gayathri; Fenwick, Elisabeth] ICON Hlth Econ & Epidemiol, Abingdon, Oxon, England; [Eby, Elizabeth L.] Medtron Plc, Mounds View, MN USA; [Brown, Benedict; Eggington, Simon] Medtron Int Trading Sarl, Tolochenaz, Switzerland; [Lyon, Julie] Medtron Ltd, Watford, England; [Sohail, M. Rizwan] Mayo Clin, Coll Med, Div Infect Dis & Cardiovasc Dis, Rochester, MN USA; [Wright, David Jay] Liverpool Heart & Chest Hosp, Liverpool, Merseyside, England",ICON plc; Medtronic; Mayo Clinic; Liverpool Heart & Chest Hospital,"Kay, G (通讯作者)，ICON Plc, 100 Pk Dr,Milton Pk, Abingdon OX14 1RY, Oxon, England.",gemma.kay@iconplc.com,"Sohail, Muhammad/K-1803-2016","Sohail, Muhammad/0000-0001-6355-0526",Medtronic,Medtronic(Medtronic),Funding for the analysis and publication charges for this article was provided by Medtronic.,,21,36,36,0,3,TAYLOR & FRANCIS LTD,ABINGDON,"2-4 PARK SQUARE, MILTON PARK, ABINGDON OR14 4RN, OXON, ENGLAND",1369-6998,1941-837X,,J MED ECON,J. Med. Econ.,,2018,21,3.0,,,,,294,300,,10.1080/13696998.2017.1409227,0,,,7,"Economics; Health Care Sciences & Services; Health Policy & Services; Medicine, General & Internal",Science Citation Index Expanded (SCI-EXPANDED),Business & Economics; Health Care Sciences & Services; General & Internal Medicine,FW6KG,29171319.0,Bronze,,,2024-03-08,WOS:000425426400011,0
J,"Ramirez, MG; Niu, XL; Epstein, J; Yang, DY",,,,"Ramirez, Manuel G.; Niu, Xiaoli; Epstein, Josh; Yang, Dongyan",,,Cost-consequence analysis of a hemostatic matrix alone or in combination for spine surgery patients,JOURNAL OF MEDICAL ECONOMICS,,,English,Article,,,,,,Gelatin; thrombin; flowable hemostatic matrix; spine surgery; transfusions; cost,CARDIAC-SURGERY; THROMBIN; TRIAL,"Background: A five-year retrospective database analysis comparing the use of Floseal(1) flowable topical hemostat alone (F) and in combination with gelatin/thrombin (F +G/T) to achieve hemostasis and control surgical bleeding showed higher resource utilization for F +G/T cases relative to F matched pairs during spinal surgery. Lower resource use in the F group was characterized by shorter hospital length of stay and surgical time as well as fewer blood transfusions and less hemostat agent used per surgery. Objective: To evaluate the cost-consequence of using F compared to F + G/T in minor, major and severe spinal surgery from the US hospital perspective. Methods: A cost-consequence model was developed using the US hospital perspective. Model inputs include clinical inputs from the literature, cost inputs (hemostatic matrices, blood product transfusion, hospital stay and operating room time) from the literature, and an analysis of annual spine surgery volume (minor, major and severe) using the 2012 National Inpatient Sample (NIS) database. Costs are reported in 2017 US dollars. One-way and probabilistic sensitivity analyses address sources of variability in the results. Results: A medium-volume hospital (130 spine surgeries per year) using F versus F +G/T for spine surgeries is expected to require 85 less hours of surgical time, 58 fewer hospital days and 7 fewer blood transfusions in addition to hemostat volume savings (F: 1 mL, thrombin: 1994 mL). The cost savings associated with the hospital resources for a medium-volume hospital are expected to be $317,959 (surgical hours = $154,746, hospital days = $125,237, blood transfusions = $19,023, hemostatic agents = $18,953) or $2445 per spine surgery. Conclusions: The use of F versus F +G/T could lead to annual cost savings for US hospitals performing a low to high volume of spinal surgeries per year.","[Ramirez, Manuel G.; Yang, Dongyan] Baxter Healthcare Corp, One Baxter Pkwy, Deerfield, IL 60015 USA; [Niu, Xiaoli; Epstein, Josh] Stratevi, Santa Monica, CA USA",Baxter International Inc,"Ramirez, MG (通讯作者)，Baxter Healthcare Corp, One Baxter Pkwy, Deerfield, IL 60015 USA.",manuel_ramirez@baxter.com,"Yang, Dongyan/S-4258-2016",,Baxter Healthcare Corporation,Baxter Healthcare Corporation,The study was funded by Baxter Healthcare Corporation.,,21,3,3,0,0,TAYLOR & FRANCIS LTD,ABINGDON,"2-4 PARK SQUARE, MILTON PARK, ABINGDON OR14 4RN, OXON, ENGLAND",1369-6998,1941-837X,,J MED ECON,J. Med. Econ.,,2018,21,10.0,,,,,1041,1046,,10.1080/13696998.2018.1513261,0,,,6,"Economics; Health Care Sciences & Services; Health Policy & Services; Medicine, General & Internal",Science Citation Index Expanded (SCI-EXPANDED),Business & Economics; Health Care Sciences & Services; General & Internal Medicine,GU7EE,30112922.0,Bronze,,,2024-03-08,WOS:000445481200014,0
J,"Null, K; Kumar, V; Lissoos, T; Luo, M",,,,"Null, Kyle; Kumar, Varun; Lissoos, Trevor; Luo, Michelle",,,Infusion administration billing for vedolizumab and infliximab in inflammatory bowel disease,JOURNAL OF MEDICAL ECONOMICS,,,English,Article,,,,,,Vedolizumab; infliximab; inflammatory bowel disease; infusion administration; cost,BIOLOGIC AGENTS; COSTS; ADALIMUMAB; THERAPY; SAFE,"Aims: Increasing use of biologics has led to interest in treatment components with potential for cost savings. This study was aimed at comparing administration times and associated costs of infliximab and vedolizumab infusions for inflammatory bowel disease (IBD). Materials and methods: This study used claims data from the Symphony Health Integrated Dataverse to identify IBD patients using infliximab or vedolizumab between 20 May 2014 and 29 February 2016. Use of Current Procedural Terminology administration codes was evaluated and costs calculated using the 2016 Center for Medicare and Medicaid Services Physician Fee Schedule. Assessments included infusion times, associated costs, productivity loss using average wage estimates from the United States Bureau of Labor Statistics, and home infusion adoption. Results: A total of 10,051 infliximab and 3114 vedolizumab patients with first-hour claims were identified; 52.0% were female and 64.5% had Crohn's disease. There were 48,377 infliximab first-hour claims (mean 4.8 infusions per patient); 46,462 (96.0%) had a second-hour claim. In comparison, there were 14,717 vedolizumab claims (mean 4.7 infusions per patient), with only 411 (2.8%) second-hour claims, resulting in vedolizumab cost savings of approximately $1.27 million. The difference in second-hour infusions resulted in 46,051 additional hours of productivity loss with infliximab, and lost wages averaging $1.18 million (range $0.68-$1.77 million). Limitations: Administration costs were inferred as charge costs and not directly assessed. Productivity loss assessed time spent on infusion only, and included a small proportion of patients beyond working age. Conclusions: Second-hour infusion billing was significantly lower with vedolizumab than with infliximab, corresponding to cost savings and reduced productivity loss.","[Null, Kyle; Kumar, Varun; Lissoos, Trevor; Luo, Michelle] Takeda Pharmaceut USA Inc, One Takeda Pkwy, Deerfield, IL 60015 USA; [Kumar, Varun] Inst Clin & Econ Review, Boston, MA USA",Takeda Pharmaceutical Company Ltd; Takeda Pharmaceuticals USA Inc. (TPUSA),"Null, K (通讯作者)，Takeda Pharmaceut USA Inc, One Takeda Pkwy, Deerfield, IL 60015 USA.",kyle.null@takeda.com,,,Takeda Pharmaceuticals USA Inc.,Takeda Pharmaceuticals USA Inc.(Takeda Pharmaceutical Company Ltd),This study was funded by Takeda Pharmaceuticals USA Inc.,,33,3,3,1,2,TAYLOR & FRANCIS LTD,ABINGDON,"2-4 PARK SQUARE, MILTON PARK, ABINGDON OR14 4RN, OXON, ENGLAND",1369-6998,1941-837X,,J MED ECON,J. Med. Econ.,NOV 2,2018,21,11.0,,,,,1102,1109,,10.1080/13696998.2018.1511568,0,,,8,"Economics; Health Care Sciences & Services; Health Policy & Services; Medicine, General & Internal",Science Citation Index Expanded (SCI-EXPANDED),Business & Economics; Health Care Sciences & Services; General & Internal Medicine,GX2YK,30101633.0,Bronze,,,2024-03-08,WOS:000447587100008,0
J,"Sun, P; Veelenturf, LP; Hewitt, M; Van Woensel, T",,,,"Sun, Peng; Veelenturf, Lucas P.; Hewitt, Mike; Van Woensel, Tom",,,The time-dependent pickup and delivery problem with time windows,TRANSPORTATION RESEARCH PART B-METHODOLOGICAL,,,English,Article,,,,,,Pickup and delivery problem; Time windows; Time-dependent travel times; Branch-and-price,VEHICLE-ROUTING PROBLEM; TEAM ORIENTEERING PROBLEM; EXACT ALGORITHM; NEIGHBORHOOD SEARCH; PROFITS; BRANCH; PRICE; TRANSPORTATION; CONSTRAINTS; HEURISTICS,"In this paper, we study a family of time-dependent pickup and delivery problems with time windows to optimize the service of a transportation provider under two dimensions of operational flexibility. In the first, we consider problems wherein the transportation service provider can choose the transportation requests it serves in order to maximize profit. In the second, we consider problems wherein they can take advantage of periods of light traffic by dictating to drivers when their routes should begin. We also consider problems wherein these flexibilities are not present. We propose an exact solution approach for solving problems from this family that is based upon branch and price, wherein columns are generated via a tailored labeling algorithm. We augment the framework with adaptations of various speed-up techniques from the literature, including limited-memory subset-row cuts and route enumeration. With an extensive computational study, we assess the effectiveness of the proposed framework and the impact of the adapted techniques. (C) 2018 Elsevier Ltd. All rights reserved.","[Sun, Peng] Kuhne Logist Univ Hamburg, Hamburg, Germany; [Veelenturf, Lucas P.; Van Woensel, Tom] Eindhoven Univ Technol, Sch Ind Engn, Eindhoven, Netherlands; [Hewitt, Mike] Loyola Univ, Quinlan Sch Business, Chicago, IL 60611 USA",Kuhne Logistics University; Eindhoven University of Technology; Loyola University Chicago,"Sun, P (通讯作者)，Kuhne Logist Univ Hamburg, Hamburg, Germany.",peng.sun@the-klu.org; l.p.veelenturf@tue.nl; mhewitt3@luc.edu; t.v.woensel@tue.nl,"Hewitt, Mike/L-2329-2015; Veelenturf, Lucas/AAG-6896-2020; Van Woensel, Tom/F-2674-2010","Veelenturf, Lucas/0000-0001-6648-3015; Van Woensel, Tom/0000-0003-4766-2346",China Scholarship Council (CSC) [201206160092]; German Research Foundation (DFG) [GO 1841/5-1],China Scholarship Council (CSC)(China Scholarship Council); German Research Foundation (DFG)(German Research Foundation (DFG)),"The authors gratefully acknowledge funds provided by China Scholarship Council (CSC) under Grant No.201206160092 and the German Research Foundation (DFG, project GO 1841/5-1).",,44,51,62,5,100,PERGAMON-ELSEVIER SCIENCE LTD,OXFORD,"THE BOULEVARD, LANGFORD LANE, KIDLINGTON, OXFORD OX5 1GB, ENGLAND",0191-2615,,,TRANSPORT RES B-METH,Transp. Res. Pt. B-Methodol.,OCT,2018,116,,,,,,1,24,,10.1016/j.trb.2018.07.002,0,,,24,"Economics; Engineering, Civil; Operations Research & Management Science; Transportation; Transportation Science & Technology",Science Citation Index Expanded (SCI-EXPANDED); Social Science Citation Index (SSCI),Business & Economics; Engineering; Operations Research & Management Science; Transportation,GV7HB,,Green Published,,,2024-03-08,WOS:000446291500001,0
J,"Mallidis, I; Iakovou, E; Dekker, R; Vlachos, D",,,,"Mallidis, Ioannis; Iakovou, Eleftherios; Dekker, Rommert; Vlachos, Dimitrios",,,The impact of slow steaming on the carriers' and shippers' costs: The case of a global logistics network,TRANSPORTATION RESEARCH PART E-LOGISTICS AND TRANSPORTATION REVIEW,,,English,Article,,,,,,Slow steaming; Speed adjustment; Shipper; Carrier,,"We propose an analytical modeling methodology for quantifying the impact of slow steaming on the carrier's voyage cost and on the shipper's total landed logistics costs. The developed methodology can be employed by a carrier and a shipper in their contract negotiations, in order for the two parties to determine how they could divide between them the savings resulted from slow steaming. We demonstrate that the impact of slow steaming and speed adjustment policies on the shippers' total landed logistics costs tend to increase as the vessel travels towards the end of its voyage.","[Mallidis, Ioannis; Vlachos, Dimitrios] Aristotle Univ Thessaloniki, Dept Mech Engn, POB 461, Thessaloniki 54124, Greece; [Iakovou, Eleftherios] Texas A&M Univ, Dept Engn Technol & Ind Distribut, College Stn, TX 77843 USA; [Dekker, Rommert] Erasmus Univ, Econometr Inst, Burg Oudlaan 50, NL-3062 PA Rotterdam, Netherlands",Aristotle University of Thessaloniki; Texas A&M University System; Texas A&M University College Station; Erasmus University Rotterdam; Erasmus University Rotterdam - Excl Erasmus MC,"Mallidis, I (通讯作者)，Aristotle Univ Thessaloniki, Dept Mech Engn, POB 461, Thessaloniki 54124, Greece.",imallidi@auth.gr,"Vlachos, Dimitrios/HTR-4429-2023; Vlachos, Dimitrios/AAO-3683-2021; Dekker, Rommert/E-7620-2012","Vlachos, Dimitrios/0000-0002-0430-2386; Mallidis, Ioannis/0000-0002-1207-8564; Dekker, Rommert/0000-0003-3823-1990",,,,,51,23,25,6,25,PERGAMON-ELSEVIER SCIENCE LTD,OXFORD,"THE BOULEVARD, LANGFORD LANE, KIDLINGTON, OXFORD OX5 1GB, ENGLAND",1366-5545,,,TRANSPORT RES E-LOG,Transp. Res. Pt. e-Logist. Transp. Rev.,MAR,2018,111,,,,,,18,39,,10.1016/j.tre.2017.12.008,0,,,22,"Economics; Engineering, Civil; Operations Research & Management Science; Transportation; Transportation Science & Technology",Science Citation Index Expanded (SCI-EXPANDED); Social Science Citation Index (SSCI),Business & Economics; Engineering; Operations Research & Management Science; Transportation,FY9UB,,Green Published,,,2024-03-08,WOS:000427211300002,0
