J,"Talebian, A; Zou, B; Peivandi, A",,,,"Talebian, Ahmadreza; Zou, Bo; Peivandi, Ahmad",,,Capacity allocation in vertically integrated rail systems: A bargaining approach,TRANSPORTATION RESEARCH PART B-METHODOLOGICAL,,,English,Article,,,,,,Rail line capacity allocation; Vertically integrated systems; Bargaining game; Train schedule; Payment; Complete and incomplete information,MARGINAL COST; FREIGHT; PASSENGER; ACCESS; TIME,"This paper presents a game-theoretic bargaining approach to allocating rail line capacity in vertically integrated systems. A passenger rail agency negotiates with the host freight railroad to determine train schedules and the associated payment. The objective on the passenger side is to maximize utility, i.e., revenue minus costs of passenger train operations, passenger schedule delay and en-route delay; the freight side minimizes the costs of train departure delay, en-route delay, loss of demand, and track maintenance. Bargaining in both complete and incomplete information settings are considered; the latter arises because the freight railroad may withhold its private cost information. With complete information, we find that the equilibrium payments proposed by the passenger rail agency and the host freight railroad will each be invariant to who initiates the payment bargaining, although the actual payment does depend on who is the initiator. The equilibrium schedule maximizes system welfare. With incomplete information, the passenger rail agency may choose between pooling and separating equilibrium strategies while proposing a payment, depending on its prior belief about the cost type of the freight railroad; whereas the host freight railroad will adopt strategies that do not reveal its cost type. To identify equilibrium schedules, a pooling equilibrium is constructed along with conditions for the existence of equilibrium schedules. We further conduct numerical experiments to obtain additional policy-relevant insights. (C) 2017 Elsevier Ltd. All rights reserved.","[Talebian, Ahmadreza] Isfahan Univ Technol, Dept Transportat Engn, Esfahan 8415683111, Iran; [Zou, Bo] Univ Illinois, Dept Civil & Mat Engn, 2095 ERF,842 W Taylor St, Chicago, IL 60607 USA; [Peivandi, Ahmad] Georgia State Univ, Robinson Coll Busines, 35 Broad St NW, Atlanta, GA 30303 USA",Isfahan University of Technology; University of Illinois System; University of Illinois Chicago; University of Illinois Chicago Hospital; University System of Georgia; Georgia State University,"Zou, B (通讯作者)，Univ Illinois, Dept Civil & Mat Engn, 2095 ERF,842 W Taylor St, Chicago, IL 60607 USA.",bzou@uic.edu,"Talebian, Ahmadreza/ABD-3131-2021; Talebian, Ahmadreza/P-3646-2015","Talebian, Ahmadreza/0000-0001-6969-4512",Metropolitan Transportation Support Initiative (METSI) of the Urban Transportation Center at the University of Illinois at Chicago,Metropolitan Transportation Support Initiative (METSI) of the Urban Transportation Center at the University of Illinois at Chicago,"This research was partially supported by the Metropolitan Transportation Support Initiative (METSI) of the Urban Transportation Center at the University of Illinois at Chicago. Earlier versions of the paper were presented at 2015 Transportation Research Board (TRB) annual meeting, 2015 INFORMS annual meeting, the 6th conference of the International Association of Railway Operations Research (IAROR), the William W. Hay Railroad Engineering Seminar at the University of Illinois at Urban-Champaign, and the Chicago Metropolitan Agency for Planning (CMAP). We would like to thank Professors Christopher Barkan and Steven Harrod for helpful discussions. We also thank multiple former Amtrak employees, particularly Mark Walbrun of Hatch Mott MacDonald, for sharing their knowledge about the state-of-the-practice rail line capacity allocation in the US. We are very grateful to the anonymous reviewers for their constructive suggestions which led to substantial improvements of the paper. The views are those of the authors alone.",,49,6,7,1,13,PERGAMON-ELSEVIER SCIENCE LTD,OXFORD,"THE BOULEVARD, LANGFORD LANE, KIDLINGTON, OXFORD OX5 1GB, ENGLAND",0191-2615,,,TRANSPORT RES B-METH,Transp. Res. Pt. B-Methodol.,JAN,2018,107,,,,,,167,191,,10.1016/j.trb.2017.12.001,0,,,25,"Economics; Engineering, Civil; Operations Research & Management Science; Transportation; Transportation Science & Technology",Science Citation Index Expanded (SCI-EXPANDED); Social Science Citation Index (SSCI),Business & Economics; Engineering; Operations Research & Management Science; Transportation,FV1IN,,Green Submitted,,,2024-03-08,WOS:000424314900009,0
J,"Cloutier, M; Greene, M; Touya, M; Gagnon-Sanschagrin, P; Guerin, A",,,,"Cloutier, Martin; Greene, Mallik; Touya, Maelys; Gagnon-Sanschagrin, Patrick; Guerin, Annie",,,A real-world analysis of healthcare costs and relative risk of hyperprolactinemia associated with antipsychotic treatments in the United States,JOURNAL OF MEDICAL ECONOMICS,,,English,Article,,,,,,Hyperprolactinemia; antipsychotics; healthcare costs; risk of hyperprolactinemia; economic burden,SCHIZOPHRENIA; EFFICACY,"Aims: Antipsychotic medications are associated with an increased risk of hyperprolactinemia, but differ in their propensity to cause this complication. This study aimed to assess the economic burden of hyperprolactinemia, and to compare its risk among adult patients using atypical antipsychotics (AAs) with a mechanism of action associated with no/low vs high/moderate prolactin elevation. Methods: This retrospective cohort study was based on US Commercial and Medicaid claims databases. Healthcare costs were compared between matched hyperprolactinemia and hyperprolactinemia-free cohorts using a two-part model. Risk of hyperprolactinemia was compared between patients receiving AAs with a mechanism of action associated with no/low (no/low prolactin elevation cohort) vs high/moderate prolactin elevation (high/moderate prolactin cohort) using logistic regression. Results: In the commercially insured sample, compared to the hyperprolactinemia-free cohort (n = 499), the hyperprolactinemia cohort (n = 499) was associated with incremental total healthcare costs of $5,732 ($20,081 vs $14,349; p = .004), and incremental medical costs of $3,861 ($13,218 vs $9,357; p = .040), mainly driven by hyperprolactinemia-related costs. In the Medicaid-insured sample, compared to the hyperprolactinemia-free cohort, the hyperprolactinemia cohort was associated with incremental total healthcare costs of $10,773 ($30,763 vs $19,990; p = .004), and incremental medical costs of $9,246 ($20,859 vs $11,613; p = .004), mainly driven by hyperprolactinemia-related and mental health-related costs. The odds of hyperprolactinemia in the no/low prolactin elevation cohort were 4-5-times lower than that in the high/moderate prolactin elevation cohort (odds ratio =0.21; p < .001). Limitations: Hyperprolactinemia may be under-reported in claims data. Conclusions: Hyperprolactinemia is associated with substantial healthcare costs. AAs associated with no/low prolactin elevation reduce the risk of hyperprolactinemia by 4-5-times compared to AAs associated with moderate/high prolactin elevation. Treatment options with minimal impact on prolactin levels may contribute to reducing hyperprolactinemia burden in AA-treated patients.","[Cloutier, Martin; Gagnon-Sanschagrin, Patrick; Guerin, Annie] Anal Grp Inc, Montreal, PQ, Canada; [Greene, Mallik] Otsuka Pharmaceut Dev & Commercializat Inc, Princeton, NJ 08540 USA; [Touya, Maelys] Lundbeck, Deerfield, IL USA",Analysis Group Inc.; Otsuka Pharmaceutical,"Greene, M (通讯作者)，Otsuka Pharmaceut Dev & Commercializat Inc, Hlth Econ & Outcomes Res, 508 Carnegie Ctr, Princeton, NJ 08540 USA.",mallik.greene@otsuka-us.com,,,"Otsuka Pharmaceuticals, Inc.; Lundbeck, LLC","Otsuka Pharmaceuticals, Inc.; Lundbeck, LLC","This research was funded by Otsuka Pharmaceuticals, Inc. and Lundbeck, LLC. The study sponsor was involved in all stages of the study and in the decision to submit this work for publication.",,18,2,2,0,1,TAYLOR & FRANCIS LTD,ABINGDON,"2-4 PARK SQUARE, MILTON PARK, ABINGDON OR14 4RN, OXON, ENGLAND",1369-6998,1941-837X,,J MED ECON,J. Med. Econ.,DEC 2,2018,21,12.0,,,,,1183,1190,,10.1080/13696998.2018.1521415,0,,,8,"Economics; Health Care Sciences & Services; Health Policy & Services; Medicine, General & Internal",Science Citation Index Expanded (SCI-EXPANDED),Business & Economics; Health Care Sciences & Services; General & Internal Medicine,HC1WQ,30188234.0,Green Submitted,,,2024-03-08,WOS:000451594400006,0
J,"Morshedlou, N; González, AD; Barker, K",,,,"Morshedlou, Nazanin; Gonzalez, Andres D.; Barker, Kash",,,Work crew routing problem for infrastructure network restoration,TRANSPORTATION RESEARCH PART B-METHODOLOGICAL,,,English,Article,,,,,,Restorative capacity planning; Routing problem; Infrastructure networks; Heuristic; Network resilience,RESILIENCE; DESIGN; RECOVERY,"This paper introduces a synchronized routing problem for planning and scheduling restorative efforts for infrastructure networks in the aftermath of a disruptive event. In this problem, a set of restoration crews are dispatched from depots to a road network to restore the disrupted infrastructure network. Two mathematical formulations are presented to scheduling and sequencing disrupted network components to restoration crews and route the crews towards disrupted components to maximize network resilience progress in any given time horizon. In the first formulation, the number of restoration crews assigned to each disrupted component, the arrival time of each assigned crew to each disrupted component and consequently the restoration rate associated with each disrupted component are considered as variables to increase the flexibility of the model in the presence of different disruptive events. Along with the contributions applies in the first formulation, in the second formulation, each disrupted component can be partially active during its restoration process. To find the coordinated routes, we propose a relaxed mixed integer program as well as a set of valid inequalities which relates the planning and scheduling efforts to decision makers policies. The integration of the relaxed formulation and valid inequalities results in a lower bound for the original formulations. We further introduce a feasibility algorithm to derive a strong initial solution for the routing restorative capacity problem. Computational results on gas, water, and electric power infrastructure network instances from Shelby County, TN data, demonstrates both the effectiveness of the proposed model formulation, in solving small to medium scale problems, the strength of the initial solution procedure, especially for large scale problems. (C) 2018 Elsevier Ltd. All rights reserved.","[Morshedlou, Nazanin; Gonzalez, Andres D.; Barker, Kash] Univ Oklahoma, Sch Ind & Syst Engn, Norman, OK 73019 USA",University of Oklahoma System; University of Oklahoma - Norman,"Barker, K (通讯作者)，Univ Oklahoma, Sch Ind & Syst Engn, Norman, OK 73019 USA.",kashbarker@ou.edu,"Barker, Kash/GQA-6312-2022; González, Andrés D./AAL-2814-2020","González, Andrés D./0000-0003-0613-5224; Barker, Kash/0000-0002-0142-1558","National Science Foundation [1635813]; Div Of Civil, Mechanical, & Manufact Inn; Directorate For Engineering [1635813] Funding Source: National Science Foundation","National Science Foundation(National Science Foundation (NSF)); Div Of Civil, Mechanical, & Manufact Inn; Directorate For Engineering(National Science Foundation (NSF)NSF - Directorate for Engineering (ENG))",This work was supported in part by the National Science Foundation through award 1635813.,,37,42,50,3,24,PERGAMON-ELSEVIER SCIENCE LTD,OXFORD,"THE BOULEVARD, LANGFORD LANE, KIDLINGTON, OXFORD OX5 1GB, ENGLAND",0191-2615,,,TRANSPORT RES B-METH,Transp. Res. Pt. B-Methodol.,DEC,2018,118,,,,,,66,89,,10.1016/j.trb.2018.10.001,0,,,24,"Economics; Engineering, Civil; Operations Research & Management Science; Transportation; Transportation Science & Technology",Science Citation Index Expanded (SCI-EXPANDED); Social Science Citation Index (SSCI),Business & Economics; Engineering; Operations Research & Management Science; Transportation,HF8CD,,hybrid,,,2024-03-08,WOS:000454467600003,0
J,"Murage, MJ; Anderson, A; Oliveria, SA; Casso, D; Ojeh, CK; Muram, TM; Merola, JF; Araujo, AB",,,,"Murage, Mwangi J.; Anderson, Amanda; Oliveria, Susan A.; Casso, Deborah; Ojeh, Clement K.; Muram, Talia M.; Merola, Joseph F.; Araujo, Andre B.",,,"Healthcare resource utilization and costs among psoriasis patients treated with biologics, overall and by disease severity",JOURNAL OF MEDICAL ECONOMICS,,,English,Article,,,,,,Psoriasis; biologics; healthcare costs; resource utilization; psoriasis disease severity,PHYSICIANS GLOBAL ASSESSMENT; UNITED-STATES; PLAQUE PSORIASIS; ECONOMIC BURDEN; ARTHRITIS; COMORBIDITIES; PREVALENCE; US; EPIDEMIOLOGY; POPULATION,"Aims: To describe healthcare resource utilization (HCRU) and costs among biologic-treated psoriasis patients in the US, overall and by disease severity. Materials and methods: IQVIA PharMetrics Plus administrative claims data were linked with Modernizing Medicine Data Services Electronic Health Record data and used to select adult psoriasis patients between April 1, 2010 and December 31, 2014. Eligible patients were classified by disease severity (mild, moderate, severe) using a hierarchy of available clinical measures. One-year outcomes included all-cause and psoriasis-related outpatient, emergency department, inpatient, and pharmacy HCRU and costs. Results: This study identified 2,130 biologic-treated psoriasis patients: 282 (13%) had mild, 116 (5%) moderate, and 49 (2%) severe disease; 1,683 (79%) could not be classified. The mean age was 47.6 years; 45.4% were female. Relative to mild psoriasis patients, patients with moderate or severe disease had more median all-cause outpatient encounters (28.0 [mild] vs 32.0 [moderate], 36.0 [severe]), more median psoriasis-related outpatient encounters (6.0 [mild] vs 7.5 [moderate], 8.0 [severe]), and a higher proportion of overall claims for medications that were psoriasis-related (28% [mild] vs 37% [moderate], 34% [severe]). Relative to mild psoriasis patients, patients with moderate or severe disease had higher median all-cause total costs ($37.7k [mild] vs $42.3k [moderate], $49.3k [severe]), higher median psoriasis-related total costs ($32.7k [mild] vs $34.9k [moderate], $40.5k [severe]), higher median all-cause pharmacy costs ($33.9k [mild] vs $36.5k [moderate], $36.4k [severe]), and higher median psoriasis-related pharmacy costs ($32.2k [mild] vs $33.9k [moderate], $35.6k [severe]). Limitations: The assessment of psoriasis disease severity may not have necessarily coincided with the timing of biologic use. The definition of disease severity prevented the assessment of temporality, and may have introduced selection bias. Conclusions: Biologic-treated patients with moderate or severe psoriasis cost the healthcare system more than patients with mild psoriasis, primarily driven by higher pharmacy costs and more outpatient encounters.","[Murage, Mwangi J.; Ojeh, Clement K.; Muram, Talia M.; Araujo, Andre B.] Eli Lilly & Co, Indianapolis, IN 46221 USA; [Anderson, Amanda; Oliveria, Susan A.; Casso, Deborah] IQVIA, Epidemiol & Drug Safety, Plymouth Meeting, PA USA; [Merola, Joseph F.] Harvard Med Sch, Brigham & Womens Hosp, Boston, MA USA",Eli Lilly; IQVIA; Harvard University; Harvard Medical School; Brigham & Women's Hospital,"Murage, MJ (通讯作者)，Eli Lilly & Co, GPORWE, LCT South Bldg 172-2,Drop Code 5028, Indianapolis, IN 46221 USA.",murage_mwangi_james@lilly.com,"Muram, Talia/AAC-1208-2022","Merola, Joseph/0000-0001-6514-4353",Eli Lilly and Company (Lilly),Eli Lilly and Company (Lilly),"This study was funded by Eli Lilly and Company (Lilly). MJM, CKO, TMM, and ABA are employees of Lilly. AA, SAO, and DC are employees of IQVIA. JFM is an employee of Brigham and Women's Hospital.",,36,10,11,1,1,TAYLOR & FRANCIS LTD,ABINGDON,"2-4 PARK SQUARE, MILTON PARK, ABINGDON OR14 4RN, OXON, ENGLAND",1369-6998,1941-837X,,J MED ECON,J. Med. Econ.,,2018,21,8.0,,,,,745,754,,10.1080/13696998.2018.1472097,0,,,10,"Economics; Health Care Sciences & Services; Health Policy & Services; Medicine, General & Internal",Science Citation Index Expanded (SCI-EXPANDED),Business & Economics; Health Care Sciences & Services; General & Internal Medicine,GU8DK,29718756.0,Bronze,,,2024-03-08,WOS:000445564700002,0
J,"Zhang, YH; Ioannou, PA",,,,"Zhang, Yihang; Ioannou, Petros A.",,,Stability analysis and variable speed limit control of a traffic flow model,TRANSPORTATION RESEARCH PART B-METHODOLOGICAL,,,English,Article,,,,,,Cell transmission model; Variable speed limit; Stability,CELL TRANSMISSION MODEL; LANE CHANGE CONTROL; COMMUNICATION-SYSTEMS; VEHICLE AUTOMATION; OPTIMIZATION,"The cell transmission traffic flow model (CTM) has attracted considerable interest in the field of transportation due to its simplicity as well as the ability to capture most of the macroscopic traffic flow characteristics. The stability properties of the CTM under different demand and capacity constraints are not always obvious. In addition, the impact of microscopic phenomena such as forced lane changes at bottlenecks leading to capacity drop is not captured by the CTM. In this paper, we start with a single section and modify the CTM to account for capacity drop. We analyze the stability properties of the CTM under all possible demand and capacity constraints as well as all possible initial density conditions. The analysis is used to motivate the design of variable speed limit (VSL) control to overcome capacity drop and achieve the maximum possible flow under all feasible traffic situations. The results are extended to multiple sections, where the stability properties of the open-loop system are analyzed and a VSL control scheme is designed and shown to achieve the objective of maximizing the traffic flow under different demand and capacity constraints. Unlike the open loop system where an infinite number of equilibrium points exist under certain demand levels, the proposed nonlinear VSL scheme guarantees exponential convergence to a unique equilibrium point that corresponds to maximum possible flow and speed under all possible demand levels and capacity constraints. (C) 2018 Elsevier Ltd. All rights reserved.","[Zhang, Yihang; Ioannou, Petros A.] Univ Southern Calif, Dept Elect Engn, 3740 McClintock Ave, Los Angeles, CA 90089 USA",University of Southern California,"Zhang, YH (通讯作者)，Univ Southern Calif, Dept Elect Engn, 3740 McClintock Ave, Los Angeles, CA 90089 USA.",yihangzh@usc.edu; ioannou@usc.edu,"Zhang, Yihang/D-2482-2016","Zhang, Yihang/0000-0003-1188-8343",National Science Foundation [1545130]; METRANS from the National Center for Sustainable Transportation of the University of California at Davis - Department of Transportation [53-5701-2432]; Air Quality Metropolitan District (AQMD) through University of California Riverside [S-000935]; Direct For Computer & Info Scie & Enginr; Division Of Computer and Network Systems [1545130] Funding Source: National Science Foundation,National Science Foundation(National Science Foundation (NSF)); METRANS from the National Center for Sustainable Transportation of the University of California at Davis - Department of Transportation; Air Quality Metropolitan District (AQMD) through University of California Riverside; Direct For Computer & Info Scie & Enginr; Division Of Computer and Network Systems(National Science Foundation (NSF)NSF - Directorate for Computer & Information Science & Engineering (CISE)),"This work has been supported in part by the National Science Foundation (under grant 1545130) and by METRANS in part from the National Center for Sustainable Transportation of the University of California at Davis, funded by the Department of Transportation (under grant 53-5701-2432) and in part by the Air Quality Metropolitan District (AQMD) through a subcontract from the University of California Riverside (Award ID: S-000935).",,26,22,25,8,40,PERGAMON-ELSEVIER SCIENCE LTD,OXFORD,"THE BOULEVARD, LANGFORD LANE, KIDLINGTON, OXFORD OX5 1GB, ENGLAND",0191-2615,1879-2367,,TRANSPORT RES B-METH,Transp. Res. Pt. B-Methodol.,DEC,2018,118,,,,,,31,65,,10.1016/j.trb.2018.10.005,0,,,35,"Economics; Engineering, Civil; Operations Research & Management Science; Transportation; Transportation Science & Technology",Science Citation Index Expanded (SCI-EXPANDED); Social Science Citation Index (SSCI),Business & Economics; Engineering; Operations Research & Management Science; Transportation,HF8CD,,Bronze,,,2024-03-08,WOS:000454467600002,0
J,"Hettle, R; Harty, G; Wong, SL",,,,"Hettle, Robert; Harty, Gerard; Wong, Schiffon L.",,,"Cost-effectiveness of cladribine tablets, alemtuzumab, and natalizumab in the treatment of relapsing-remitting multiple sclerosis with high disease activity in England",JOURNAL OF MEDICAL ECONOMICS,,,English,Article,,,,,,Cladribine tablets; alemtuzumab; natalizumab; multiple sclerosis; cost-effectiveness,PLACEBO-CONTROLLED TRIAL; INTERFERON-BETA; MODIFYING THERAPIES; GLATIRAMER ACETATE; CLARITY EXTENSION; NATURAL-HISTORY; PEOPLE; UK; MANAGEMENT; UTILITIES,"Aims: Cladribine tablets were the first oral short-course treatment approved for highly active relapsing multiple sclerosis (MS). The Association of British Neurologists guidelines currently recommend two infusion therapies, alemtuzumab and natalizumab, to treat high disease activity relapsing remitting MS (HDA-RRMS). This analysis assessed the cost-effectiveness of cladribine tablets in HDA-RRMS compared with alemtuzumab and natalizumab, from the perspective of the National Health Service (NHS) in England. Materials and methods: A cohort-based Markov model with 11 health states (10 Expanded Disability Status Scale [EDSS] plus death) was developed. Transition matrices from the British Columbia registry were used to model the natural history of EDSS. The treatment effect on EDSS was modelled using hazard ratios for 6-month confirmed disability progression from an indirect treatment comparison (ITC). Relapses and drug-related adverse events were modeled via annualized relapse rates and event probabilities, with associated costs and quality-adjusted life year (QALY) losses. Utilities were derived from trials and the literature, and costs from NHS and literature sources. Uncertainty was assessed via probabilistic and deterministic sensitivity analyses. Results: Cladribine tablets were dominant (i.e., less costly and more effective) vs alemtuzumab and natalizumab in pairwise comparisons, and the dominant strategy in fully incremental analyses. Incremental cost was driven largely by drug acquisition and administration costs, and incremental QALY gain largely by differences in delayed EDSS progression. Cladribine tablets had a 93% probability of being cost-effective at a threshold of GBP 30,000 per QALY gained, and remained dominant across the scenario analyses tested. The greatest influence on results was the treatment effect on disability progression derived from the ITC. Limitations: Uncertainty over the efficacy of DMT beyond trial durations. In line with other comparative effectiveness analyses, the network meta-analysis informing this cost-effectiveness analysis was associated with a degree of uncertainty. No treatment switching analyses were undertaken. Conclusions: Cladribine tablets are a cost-effective alternative to alemtuzumab and natalizumab in the treatment of HDA-RRMS from the perspective of the NHS in England.","[Hettle, Robert] Parexel Access Consulting, Parexel Int, Uxbridge, Middx, England; [Harty, Gerard] MERCK, Feltham, England; [Wong, Schiffon L.] EMD Serono Inc, Billerica, MA USA",Parexel International; Merck & Company; Merck KGaA; EMD Serono Inc.,"Harty, G (通讯作者)，Global Evidence & Value Dev, 45A Middlesex Turnpike, Billerica, MA 01821 USA.",gerard.harty@emdserono.com,,,"EMD Serono, Inc., a business of Merck KGaA, Darmstadt, Germany","EMD Serono, Inc., a business of Merck KGaA, Darmstadt, Germany","Editorial assistance was provided by Jo Whelan (Textpharm Ltd., Oxford, UK) funded by EMD Serono, Inc., a business of Merck KGaA, Darmstadt, Germany.",,51,25,25,0,2,TAYLOR & FRANCIS LTD,ABINGDON,"2-4 PARK SQUARE, MILTON PARK, ABINGDON OR14 4RN, OXON, ENGLAND",1369-6998,1941-837X,,J MED ECON,J. Med. Econ.,,2018,21,7.0,,,,,676,686,,10.1080/13696998.2018.1461630,0,,,11,"Economics; Health Care Sciences & Services; Health Policy & Services; Medicine, General & Internal",Science Citation Index Expanded (SCI-EXPANDED),Business & Economics; Health Care Sciences & Services; General & Internal Medicine,GK9OO,29618273.0,Bronze,,,2024-03-08,WOS:000436581300005,0
