Publication Type,Authors,Book Authors,Book Editors,Book Group Authors,Author Full Names,Book Author Full Names,Group Authors,Article Title,Source Title,Book Series Title,Book Series Subtitle,Language,Document Type,Conference Title,Conference Date,Conference Location,Conference Sponsor,Conference Host,Author Keywords,Keywords Plus,Abstract,Addresses,Affiliations,Reprint Addresses,Email Addresses,Researcher Ids,ORCIDs,Funding Orgs,Funding Name Preferred,Funding Text,Cited References,Cited Reference Count,"Times Cited, WoS Core","Times Cited, All Databases",180 Day Usage Count,Since 2013 Usage Count,Publisher,Publisher City,Publisher Address,ISSN,eISSN,ISBN,Journal Abbreviation,Journal ISO Abbreviation,Publication Date,Publication Year,Volume,Issue,Part Number,Supplement,Special Issue,Meeting Abstract,Start Page,End Page,Article Number,DOI,DOI Link,Book DOI,Early Access Date,Number of Pages,WoS Categories,Web of Science Index,Research Areas,IDS Number,Pubmed Id,Open Access Designations,Highly Cited Status,Hot Paper Status,Date of Export,UT (Unique WOS ID),Web of Science Record
J,"Subramanyam, A; Wang, A; Gounaris, CE",,,,"Subramanyam, Anirudh; Wang, Akang; Gounaris, Chrysanthos E.",,,A scenario decomposition algorithm for strategic time window assignment vehicle routing problems,TRANSPORTATION RESEARCH PART B-METHODOLOGICAL,,,English,Article,,,,,,Vehicle routing under uncertainty; Time window assignment; Service consistency; Stochastic programming; Decomposition; Branch-and-bound,CUT-AND-PRICE; NEIGHBORHOOD SEARCH; SLOT MANAGEMENT; LENGTH,"We study the strategic decision-making problem of assigning time windows to customers in the context of vehicle routing applications that are affected by operational uncertainty. This problem, known as the Time Window Assignment Vehicle Routing Problem, can be viewed as a two-stage stochastic optimization problem, where time window assignments constitute first-stage decisions, vehicle routes adhering to the assigned time windows constitute second-stage decisions, and the objective is to minimize the expected routing costs. To that end, we develop in this paper a new scenario decomposition algorithm to solve the sampled deterministic equivalent of this stochastic model. From a modeling viewpoint, our approach can accommodate both continuous and discrete sets of feasible time window assignments as well as general scenario-based models of uncertainty for several routing specific parameters, including customer demands and travel times, among others. From an algorithmic viewpoint, our approach can be easily parallelized, can utilize any available vehicle routing solver as a black box, and can be readily modified as a heuristic for large-scale instances. We perform a comprehensive computational study to demonstrate that our algorithm strongly outperforms all existing solution methods, as well as to quantify the trade-off between computational tractability and expected cost savings when considering a larger number of future scenarios during strategic time window assignment. (C) 2018 Elsevier Ltd. All rights reserved.","[Subramanyam, Anirudh; Wang, Akang; Gounaris, Chrysanthos E.] Carnegie Mellon Univ, Dept Chem Engn, 5000 Forbes Ave, Pittsburgh, PA 15213 USA",Carnegie Mellon University,"Gounaris, CE (通讯作者)，Carnegie Mellon Univ, Dept Chem Engn, 5000 Forbes Ave, Pittsburgh, PA 15213 USA.",gounaris@cmu.edu,"Gounaris, Chrysanthos E./G-2317-2014","Wang, Akang/0000-0002-3325-8441; Gounaris, Chrysanthos/0000-0001-5779-2510; Subramanyam, Anirudh/0000-0001-5255-8821",United States National Science Foundation [CMMI-1434682]; John and Claire Bertucci Graduate Fellowship program; James C. Meade Fellowship program at Carnegie Mellon University,United States National Science Foundation(National Science Foundation (NSF)); John and Claire Bertucci Graduate Fellowship program; James C. Meade Fellowship program at Carnegie Mellon University,"We acknowledge support from the United States National Science Foundation, award number CMMI-1434682. Anirudh Subramanyam and Akang Wang also acknowledge support from, respectively, the John and Claire Bertucci Graduate Fellowship program and the James C. Meade Fellowship program at Carnegie Mellon University.",,40,27,29,4,33,PERGAMON-ELSEVIER SCIENCE LTD,OXFORD,"THE BOULEVARD, LANGFORD LANE, KIDLINGTON, OXFORD OX5 1GB, ENGLAND",0191-2615,,,TRANSPORT RES B-METH,Transp. Res. Pt. B-Methodol.,NOV,2018,117,,A,,,,296,317,,10.1016/j.trb.2018.09.008,0,,,22,"Economics; Engineering, Civil; Operations Research & Management Science; Transportation; Transportation Science & Technology",Science Citation Index Expanded (SCI-EXPANDED); Social Science Citation Index (SSCI),Business & Economics; Engineering; Operations Research & Management Science; Transportation,HH2PC,,"hybrid, Green Submitted",,,2024-03-08,WOS:000455559600015,0
J,"Du, WB; Zhang, MY; Zhang, Y; Cao, XB; Zhang, J",,,,"Du, Wen-Bo; Zhang, Ming-Yuan; Zhang, Yu; Cao, Xian-Bin; Zhang, Jun",,,Delay causality network in air transport systems,TRANSPORTATION RESEARCH PART E-LOGISTICS AND TRANSPORTATION REVIEW,,,English,Article,,,,,,Flight delay; Delay propagation; Delay causality; Network analysis,PROPAGATION; IMPACT; CHINA; US,"To better understand the mechanism of flight delay propagation at the system-level, we built a delay causality network (DCN) based on the Granger causality test. Through topological analysis of DCNs, we found that only about a quarter of airports were involved in delay propagation during the peak travel period and large airports affected by many upstream airports impact fewer downstream airports. Furthermore, temporal analysis of DCNs indicates that the culprits of delay propagation in the air transport system are not a fixed set of airports; instead, they vary daily depending on the operational environment.","[Du, Wen-Bo; Zhang, Ming-Yuan; Cao, Xian-Bin] Beihang Univ, Sch Elect & Informat Engn, Beijing 100191, Peoples R China; [Zhang, Ming-Yuan] Beihang Univ, Shen Yuan Honors Coll, Beijing 100191, Peoples R China; [Zhang, Yu] Univ S Florida, Dept Civil & Environm Engn, 4202 E Fowler Ave, Tampa, FL 33620 USA; [Zhang, Jun] Beijing Inst Technol, Beijing 100081, Peoples R China",Beihang University; Beihang University; State University System of Florida; University of South Florida; Beijing Institute of Technology,"Cao, XB (通讯作者)，Beihang Univ, Sch Elect & Informat Engn, Beijing 100191, Peoples R China.;Zhang, J (通讯作者)，Beijing Inst Technol, Beijing 100081, Peoples R China.",xbcao@buaa.edu.cn; buaazhangjun@vip.sina.com,"du, wen-bo/G-5959-2011","Zhang, Yu/0000-0003-1202-626X","National Key Research and Development Program of China [2016YFB1200100]; National Natural Science Foundation of China [61425014, 61521091, 91538204, 61671031, 61722102]",National Key Research and Development Program of China; National Natural Science Foundation of China(National Natural Science Foundation of China (NSFC)),"This study was supported by the National Key Research and Development Program of China (Grant No. 2016YFB1200100) and the National Natural Science Foundation of China (Grant Nos. 61425014, 61521091, 91538204, 61671031, and 61722102).",,43,97,100,7,39,PERGAMON-ELSEVIER SCIENCE LTD,OXFORD,"THE BOULEVARD, LANGFORD LANE, KIDLINGTON, OXFORD OX5 1GB, ENGLAND",1366-5545,,,TRANSPORT RES E-LOG,Transp. Res. Pt. e-Logist. Transp. Rev.,OCT,2018,118,,,,,,466,476,,10.1016/j.tre.2018.08.014,0,,,11,"Economics; Engineering, Civil; Operations Research & Management Science; Transportation; Transportation Science & Technology",Science Citation Index Expanded (SCI-EXPANDED); Social Science Citation Index (SSCI),Business & Economics; Engineering; Operations Research & Management Science; Transportation,GY0RJ,,"hybrid, Green Published",,,2024-03-08,WOS:000448229000024,0
J,"Chen, P; Nie, Y",,,,"Chen, Peng (Will); Nie, Yu (Marco)",,,Optimal design of demand adaptive paired-line hybrid transit: Case of radial route structure,TRANSPORTATION RESEARCH PART E-LOGISTICS AND TRANSPORTATION REVIEW,,,English,Article,,,,,,Hybrid transit; Demand adaptive service; Continuous approximation; Radial network; Discrete-event simulation,NETWORK DESIGN; TRANSPORTATION; OPTIMIZATION; SYSTEM; HEADWAYS; EQUILIBRIUM; POSITIONS; SERVICE; COST,"This paper studies the design problem of a demand adaptive paired-line hybrid transit system with a radial network structure. Depending on whether the demand adaptive service is operated along circular or radial transit lines, two variants of such systems are considered: a Circular Model (or C-Model) and a Radial Model (or R-Model). A continuous approximation approach is employed to develop the optimal design problem, which is formulated as a mixed integer program. A comprehensive numerical experiment is performed to compare various cost components corresponding to the optimal design of the two systems, and a discrete-event simulation is developed to validate the analysis. Numerical and simulation results suggest that the radial route network outperforms the grid route network, which was analyzed previously in the literature, with a significant margin, while the C-Model and R-Model offer similar performance.","[Chen, Peng (Will); Nie, Yu (Marco)] Northwestern Univ, Dept Civil & Environm Engn, 2145 Sheridan Rd, Evanston, IL 60208 USA",Northwestern University,"Nie, Y (通讯作者)，Northwestern Univ, Dept Civil & Environm Engn, 2145 Sheridan Rd, Evanston, IL 60208 USA.",y-nie@northwestern.edu,"Nie, Yu/B-7083-2009; Nie, Yu/J-6620-2014","Nie, Yu/0000-0003-2083-470X",National Science Foundation [CMMI-1402911],National Science Foundation(National Science Foundation (NSF)),This project was funded by National Science Foundation under the award number CMMI-1402911.,,42,27,31,4,27,PERGAMON-ELSEVIER SCIENCE LTD,OXFORD,"THE BOULEVARD, LANGFORD LANE, KIDLINGTON, OXFORD OX5 1GB, ENGLAND",1366-5545,,,TRANSPORT RES E-LOG,Transp. Res. Pt. e-Logist. Transp. Rev.,FEB,2018,110,,,,,,71,89,,10.1016/j.tre.2017.12.006,0,,,19,"Economics; Engineering, Civil; Operations Research & Management Science; Transportation; Transportation Science & Technology",Science Citation Index Expanded (SCI-EXPANDED); Social Science Citation Index (SSCI),Business & Economics; Engineering; Operations Research & Management Science; Transportation,FW7EY,,hybrid,,,2024-03-08,WOS:000425483500005,0
J,"Ansari, S; Basdere, M; Li, XP; Ouyang, YF; Smilowitz, K",,,,"Ansari, Sina; Basdere, Mehmet; Li, Xiaopeng; Ouyang, Yanfeng; Smilowitz, Karen",,,Advancements in continuous approximation models for logistics and transportation systems: 1996-2016,TRANSPORTATION RESEARCH PART B-METHODOLOGICAL,,,English,Review,,,,,,Continuous approximation; Logistics; Facility location; Distribution and transit; Supply chain management,FACILITY LOCATION DESIGN; TRAVELING SALESMAN PROBLEM; VEHICLE-ROUTING PROBLEMS; NETWORK DESIGN; PLANNING APPROXIMATIONS; SENSOR DEPLOYMENT; INVENTORY MODEL; AVERAGE LENGTH; HUB LOCATION; DELIVERY,"Continuous approximation (CA) is an efficient and parsimonious technique for modeling complex logistics problems. In this paper, we review recent studies that develop CA models for transportation, distribution and logistics problems with the aim of synthesizing recent advancements and identifying current research gaps. This survey focuses on important principles and key results from CA models. In particular, we consider how these studies fill the gaps identified by the most recent literature reviews in this field. We observe that CA models are used in a wider range of applications, especially in the areas of facility location and integrated supply chain management. Most studies use CA as an alternative and a complement to discrete solution approaches: however, CA can also be used in combination with discrete approaches. We conclude with promising areas of future work. (C) 2017 Elsevier Ltd. All rights reserved.","[Ansari, Sina; Basdere, Mehmet; Smilowitz, Karen] Northwestern Univ, Dept Ind Engn & Management Sci, Evanston, IL 60208 USA; [Li, Xiaopeng] Univ S Florida, Dept Civil & Environm Engn, Tampa, FL 33620 USA; [Ouyang, Yanfeng] Univ Illinois, Dept Civil & Environm Engn, Urbana, IL 61801 USA",Northwestern University; State University System of Florida; University of South Florida; University of Illinois System; University of Illinois Urbana-Champaign,"Basdere, M (通讯作者)，Northwestern Univ, Dept Ind Engn & Management Sci, Evanston, IL 60208 USA.",mbasdere@u.northwestern.edu,"Smilowitz, Karen R/B-7493-2009; Li, Xiaopeng/JED-7114-2023; Ansari, Sina/AAY-7808-2020","Ansari, Sina/0000-0001-5348-860X; Smilowitz, Karen/0000-0003-2905-4566","US National Science Foundation through Grant CNS [1638355]; US National Science Foundation through Grant CMMI [1234085, 1662825]; Div Of Civil, Mechanical, & Manufact Inn; Directorate For Engineering [1234085, 1662825] Funding Source: National Science Foundation","US National Science Foundation through Grant CNS(National Science Foundation (NSF)); US National Science Foundation through Grant CMMI; Div Of Civil, Mechanical, & Manufact Inn; Directorate For Engineering(National Science Foundation (NSF)NSF - Directorate for Engineering (ENG))",We would like to thank Christine Rhoades who helped with collecting and summarizing some of the references. We sincerely thank the three anonymous reviewers for their invaluable comments which enabled us to improve our work. Dr. Xiaopeng Li's work was supported by the US National Science Foundation through Grant CNS #1638355. Part of Yanfeng Ouyang's work was supported by the US National Science Foundation through Grants CMMI #1234085 and CMMI #1662825.,,151,58,67,7,90,PERGAMON-ELSEVIER SCIENCE LTD,OXFORD,"THE BOULEVARD, LANGFORD LANE, KIDLINGTON, OXFORD OX5 1GB, ENGLAND",0191-2615,1879-2367,,TRANSPORT RES B-METH,Transp. Res. Pt. B-Methodol.,JAN,2018,107,,,,,,229,252,,10.1016/j.trb.2017.09.019,0,,,24,"Economics; Engineering, Civil; Operations Research & Management Science; Transportation; Transportation Science & Technology",Science Citation Index Expanded (SCI-EXPANDED); Social Science Citation Index (SSCI),Business & Economics; Engineering; Operations Research & Management Science; Transportation,FV1IN,,hybrid,,,2024-03-08,WOS:000424314900012,0
J,"Drazer, MW; Sweis, RF",,,,"Drazer, Michael W.; Sweis, Randy F.",,,Low clinical adoption of tumor genomic profiling: cause for concern?,JOURNAL OF MEDICAL ECONOMICS,,,English,Editorial Material,,,,,,,FDA APPROVAL; CANCER; CHEMOTHERAPY; GUIDELINES; EXPERIENCE; INHIBITOR; CETUXIMAB; VARIANTS; BARRIERS; ONCOLOGY,,"[Drazer, Michael W.; Sweis, Randy F.] Univ Chicago, Oncol Comprehens Canc Ctr, Dept Med, Sect Hematol, Chicago, IL 60637 USA; [Drazer, Michael W.] Univ Chicago, Dept Human Genet, Chicago, IL 60637 USA; [Sweis, Randy F.] Univ Chicago, Comm Clin Pharmacol & Pharmacogen, Chicago, IL 60637 USA",University of Chicago; University of Chicago; University of Chicago,"Sweis, RF (通讯作者)，Univ Chicago Med, 5841 South Maryland Ave,MC 2115, Chicago, IL 60637 USA.",rsweis@uchicago.edu,,,NIH [K12CA139160]; AACR [16-40-15-SWEIS]; ASCO-Conquer Cancer Foundation - Young Investigator Award; Physician Scientist Training Award from the Damon Runyon Cancer Research Foundation,NIH(United States Department of Health & Human ServicesNational Institutes of Health (NIH) - USA); AACR; ASCO-Conquer Cancer Foundation - Young Investigator Award; Physician Scientist Training Award from the Damon Runyon Cancer Research Foundation,"Supported by NIH K12CA139160 (R.F.S), AACR # 16-40-15-SWEIS (R.F.S.), 2017 ASCO-Conquer Cancer Foundation - Young Investigator Award (R.F.S). MWD is funded by a Physician Scientist Training Award from the Damon Runyon Cancer Research Foundation.",,26,0,0,0,3,TAYLOR & FRANCIS LTD,ABINGDON,"2-4 PARK SQUARE, MILTON PARK, ABINGDON OR14 4RN, OXON, ENGLAND",1369-6998,1941-837X,,J MED ECON,J. Med. Econ.,,2018,21,7.0,,,,,721,723,,10.1080/13696998.2018.1470978,0,,,3,"Economics; Health Care Sciences & Services; Health Policy & Services; Medicine, General & Internal",Science Citation Index Expanded (SCI-EXPANDED),Business & Economics; Health Care Sciences & Services; General & Internal Medicine,GK9OO,29708449.0,"Green Accepted, Bronze",,,2024-03-08,WOS:000436581300011,0
J,"Lamerato, L; Price, K; Szymialis, R; Eaddy, M; Ogbonnaya, A; Shih, HC; Ahmad, H",,,,"Lamerato, Lois; Price, Kwanza; Szymialis, Rick; Eaddy, Michael; Ogbonnaya, Augustina; Shih, Huai-Che; Ahmad, Harris",,,Comparative evaluation of treatment patterns and healthcare utilization of newly-diagnosed rheumatoid arthritis patients by anti-cyclic citrullinated peptide antibody status,JOURNAL OF MEDICAL ECONOMICS,,,English,Article,,,,,,Rheumatoid arthritis; healthcare utilization; anti-cyclic citrullinated peptide; CCP,ABATACEPT; OUTCOMES; REGISTRY,"Background: Anti-cyclic citrullinated peptide (CCP) antibody positivity is an established diagnostic factor for severe disease activity and joint damage and a prognostic factor for aggressive disease in rheumatoid arthritis (RA). Objective: To compare RA-related treatment, healthcare utilization, and joint erosion between anti-CCP-positive and anti-CCP-negative RA patients. Methods: Newly-diagnosed RA patients were identified from the Henry Ford Health System database between January 1, 2009 and December 31, 2014; the date of the first RA diagnosis within the study period was the index date. Baseline anti-CCP test was used to categorize patients as anti-CCP-positive or anti-CCP-negative, and outcomes were evaluated in the 6 months post-index. Results: There were 217 anti-CCP-positive and 191 anti-CCP-negative RA patients included in the study. A higher proportion of anti-CCP-positive patients were initiated on RA treatment than anti-CCP-negative patients (70.5% vs 23.0%; p<.0001). More anti-CCP-positive patients received methotrexate (73.2% vs 56.8%; p=.0374), while more anti-CCP-negative patients received hydroxychloroquine (31.8% vs 13.1%; p=.0037) in first-line therapy. A higher proportion of anti-CCP-negative patients were tested for rheumatoid factor (RF) and erythrocyte sedimentation rate (ESR). Of those tested, there were more positive test results in the anti-CCP-positive cohort compared to the anti-CCP-negative cohort (RF: 84.4% vs 18.2%, p<.0001; C-reactive protein [CRP]: 69.7% vs 48.3%, p=.0008; and ESR: 89.5% vs 53.9%, p<.0001). Outpatient utilization predominated, with more anti-CCP-positive patients having any outpatient physician office visit (96.3% vs 77.5%, p<.0001) and a higher mean number of visits (5.3 vs 2.5, p<.0001) than anti-CCP-negative patients. Among anti-CCP-positive (n=113) and anti-CCP-negative (n=58) patients with imaging results, more anti-CCP-positive patients had joint erosion compared to anti-CCP-negative patients (18.6% vs 8.6%; p=.0858); however, statistical significance was not reached. Conclusion: RA patients with positive anti-CCP antibodies had higher degrees of inflammation and disease activity as indicated by laboratory results, which likely contributed to their higher rates of healthcare utilization, joint erosion, and proportions of RA treatment.","[Lamerato, Lois] Henry Ford Hlth Syst, Detroit, MI USA; [Price, Kwanza; Szymialis, Rick; Ahmad, Harris] Bristol Myers Squibb, Princeton, NJ USA; [Eaddy, Michael; Ogbonnaya, Augustina; Shih, Huai-Che] Xcenda LLC, Palm Harbor, FL USA","Henry Ford Health System; Henry Ford Hospital; Bristol-Myers Squibb; AmerisourceBergen Corporation; Xcenda, LLC","Price, K (通讯作者)，Bristol Myers Squibb Co, 3401 Princeton Pike, Lawrenceville, NJ 08648 USA.",kwanza.price@bms.com,,,"Bristol-Myers Squibb; Xcenda, LLC","Bristol-Myers Squibb(Bristol-Myers Squibb); Xcenda, LLC","This study was funded by Bristol-Myers Squibb. Xcenda, LLC received funding from Bristol-Myers Squibb to conduct this study and develop the manuscript. Henry Ford Health System received research funding from Xcenda, LLC.",,18,1,2,0,3,TAYLOR & FRANCIS LTD,ABINGDON,"2-4 PARK SQUARE, MILTON PARK, ABINGDON OR14 4RN, OXON, ENGLAND",1369-6998,1941-837X,,J MED ECON,J. Med. Econ.,,2018,21,3.0,,,,,231,240,,10.1080/13696998.2017.1391819,0,,,10,"Economics; Health Care Sciences & Services; Health Policy & Services; Medicine, General & Internal",Science Citation Index Expanded (SCI-EXPANDED),Business & Economics; Health Care Sciences & Services; General & Internal Medicine,FW6KG,29027497.0,Bronze,,,2024-03-08,WOS:000425426400002,0
J,"Bell, CF; Coutinho, AD; Farrelly, E; Lokhandwala, T; Landsman-Blumberg, P",,,,"Bell, Christopher F.; Coutinho, Anna D.; Farrelly, Eileen; Lokhandwala, Tasneem; Landsman-Blumberg, Pamela",,,Clinical and economic outcomes associated with the use of fluticasone propionate 250 mcg and salmeterol 50 mcg combination versus tiotropium bromide: 18 mcg as initial maintenance treatment for chronic obstructive pulmonary disease in managed care,JOURNAL OF MEDICAL ECONOMICS,,,English,Article,,,,,,Chronic obstructive pulmonary disease (COPD); fluticasone propionate; salmeterol tiotropium bromide; maintenance treatment naive COPD; healthcare claims; economic burden; clinical outcomes,COMORBIDITY INDEX; BUDESONIDE/FORMOTEROL COMBINATION; EXACERBATION FREQUENCY; ADMINISTRATIVE DATA; UNITED-STATES; COPD PATIENTS; COSTS; THERAPY; IPRATROPIUM; SYMPTOMS,"Aims: To examine the clinical and economic outcomes associated with the use of long-acting bronchodilators for initial maintenance treatment of chronic obstructive pulmonary disease (COPD) by analyzing health insurance claims data in the US. Methods: A retrospective, observational, matched cohort study used health insurance claims data (January 2008 to June 2013) to assess COPD-related outcomes for subjects aged >= 40 years. Subjects were assigned to a study cohort according to the first observed prescription fill for a long-acting bronchodilator (fluticasone propionate 250 mcg/salmeterol 50 mcg [FSC] or tiotropium bromide 18 mcg [TIO]). The analysis period for each subject comprised a 1-year pre-index date and 1-year post-index date. Primary outcome measure was total COPD-related costs per-patient per-year (PPPY) during the follow-up period. Secondary outcome measures included COPD-related exacerbations and the components of COPD-related costs. Results: Overall, 24,040 subjects were identified; the analysis sample consisted of 19,090 subjects (9,545 per cohort) with no significant differences between cohorts. Mean COPD-related total costs PPPY were numerically lower among the FSC cohort; however, the difference was not statistically significant ($2,224 [+/- 4,108] vs $2,352 [+/- 3,721], p=.057). There was no difference between cohorts for COPD-related medical costs (p = .894) . COPD-related pharmacy costs were significantly, yet modestly, lower in the FSC cohort compared with the TIO cohort ($1,160 [+/- 1,1061 vs 1,275 [+/- 1,110], p < .001). There were no statistically significant differences in the rate or number of exacerbations between the matched cohorts. Limitations: While propensity scoring achieved balance in baseline characteristics, some residual confounding unobserved in the database may be present. Conclusions: Few clinical and economic differences between subjects initiating maintenance therapy with FSC or TIO were observed.","[Bell, Christopher F.] GlaxoSmithKline, Res Triangle Pk, NC USA; [Coutinho, Anna D.; Farrelly, Eileen; Lokhandwala, Tasneem; Landsman-Blumberg, Pamela] Xcenda, Palm Harbor, FL USA","GlaxoSmithKline; AmerisourceBergen Corporation; Xcenda, LLC","Bell, CF (通讯作者)，GlaxoSmithKline, US Med Affairs, CEVEO, 5 Moore Dr, Res Triangle Pk, NC 27709 USA.",christopher.f.bell@gsk.com,,"Lokhandwala, Tasneem/0000-0002-1983-9557",GlaxoSmithKline (GSK) [HO-14-14965/201512],GlaxoSmithKline (GSK)(GlaxoSmithKline),This manuscript was funded by GlaxoSmithKline (GSK) (HO-14-14965/201512).,,50,0,1,0,1,TAYLOR & FRANCIS LTD,ABINGDON,"2-4 PARK SQUARE, MILTON PARK, ABINGDON OR14 4RN, OXON, ENGLAND",1369-6998,1941-837X,,J MED ECON,J. Med. Econ.,,2018,21,6.0,,,,,629,638,,10.1080/13696998.2018.1457532,0,,,10,"Economics; Health Care Sciences & Services; Health Policy & Services; Medicine, General & Internal",Science Citation Index Expanded (SCI-EXPANDED),Business & Economics; Health Care Sciences & Services; General & Internal Medicine,GH9JS,29577787.0,"Green Submitted, Bronze",,,2024-03-08,WOS:000433986300014,0
