J,"Mantin, B; Rubin, E",,,,"Mantin, Benny; Rubin, Eran",,,Price volatility and market performance measures: The case of revenue managed goods,TRANSPORTATION RESEARCH PART E-LOGISTICS AND TRANSPORTATION REVIEW,,,English,Article,,,,,,Revenue management; Market performance assessment; Market analytics; Dynamic pricing; Price volatility; Airline industry,POTENTIAL COMPETITION; EMPIRICAL-ANALYSIS; DISPERSION; CONSUMER; PROMOTIONS; ANALYTICS; CHOICE; EQUILIBRIUM; ACCEPTANCE; KNOWLEDGE,"The operational outcome of Revenue Management (RM) is manifested in different magnitudes of market level price volatilities. In this paper we take an analytics approach to the possible use of pricing data of revenue-managed goods to support market analysis. Quantifying the relationship between market-level price volatility in the airline industry and various market-level performance metrics, we find that higher levels of price volatility are associated with higher levels of transacted fares, lower load factors, higher revenues, and increased transacted fare dispersion. This suggests the potential in utilizing market price volatility as an input for market analytics.","[Mantin, Benny] Univ Luxembourg, Luxembourg Ctr Logist & Supply Chain Management, Luxembourg, Luxembourg; [Rubin, Eran] Univ Akron, Coll Business Adm, Dept Management, Akron, OH 44325 USA",University of Luxembourg; University System of Ohio; University of Akron,"Mantin, B (通讯作者)，Univ Luxembourg, Luxembourg Ctr Logist & Supply Chain Management, Luxembourg, Luxembourg.",benny.mantin@uni.lu; erubin@uakron.edu,,"Mantin, Benny/0000-0002-5206-7851",,,,,71,3,3,1,19,PERGAMON-ELSEVIER SCIENCE LTD,OXFORD,"THE BOULEVARD, LANGFORD LANE, KIDLINGTON, OXFORD OX5 1GB, ENGLAND",1366-5545,,,TRANSPORT RES E-LOG,Transp. Res. Pt. e-Logist. Transp. Rev.,DEC,2018,120,,,,,,35,50,,10.1016/j.tre.2018.10.005,0,,,16,"Economics; Engineering, Civil; Operations Research & Management Science; Transportation; Transportation Science & Technology",Science Citation Index Expanded (SCI-EXPANDED); Social Science Citation Index (SSCI),Business & Economics; Engineering; Operations Research & Management Science; Transportation,HE2LL,,Green Submitted,,,2024-03-08,WOS:000453109500003,0
J,"Dempsey, M; Mocarski, M; Langer, J; Hunt, B",,,,"Dempsey, Michael; Mocarski, Michelle; Langer, Jakob; Hunt, Barnaby",,,Long-term cost-effectiveness analysis shows that IDegLira is associated with improved outcomes and lower costs compared with insulin glargine U100 plus insulin aspart in the US,JOURNAL OF MEDICAL ECONOMICS,,,English,Article,,,,,,Cost; cost-effectiveness; diabetes mellitus; GLP-1 receptor agonist; IDegLira; insulin; USA,FIXED-RATIO COMBINATION; HEALTH-RELATED UTILITY; DIRECT MEDICAL COSTS; CORE DIABETES MODEL; BASAL INSULIN; NAIVE PATIENTS; TYPE-2; EFFICACY; DEGLUDEC/LIRAGLUTIDE; COMPLICATIONS,"Aims: The clinical and economic impact of diabetes is growing in the US. Choosing therapies that are both effective and cost-effective is becoming increasingly important. The aim of the present analysis was to assess the long-term cost-effectiveness of IDegLira for treatment of patients with type 2 diabetes mellitus not meeting glycemic targets on basal insulin, vs insulin glargine U100 plus insulin aspart, in the US setting. Materials and methods: Long-term projections of cost-effectiveness outcomes were made using the IQVIA CORE Diabetes Model. Clinical inputs were based on the DUAL VII trial, with costs (accounted from a healthcare payer perspective) and utilities based on published sources. Future costs and clinical benefits were discounted at 3% annually. Results: IDegLira was associated with increased discounted life expectancy by 0.02 years and increased discounted quality-adjusted life expectancy by 0.22 quality-adjusted life years compared with insulin glargine U100 plus insulin aspart. Evaluation of direct medical costs suggested that the mean cost per patient with IDegLira was $3,571 lower than with insulin glargine U100 plus insulin aspart. The cost saving was driven predominantly by the lower acquisition cost of IDegLira compared with insulin glargine U100 plus insulin aspart, with further cost savings identified as a result of avoided treatment of diabetes-related complications. IDegLira was associated with improved clinical outcomes at a reduced cost compared with insulin glargine U100 plus insulin aspart. Conclusions: Based on clinical trial data, the present analysis suggests that IDegLira is associated with improved clinical outcomes and cost savings compared with treatment with insulin glargine U100 plus insulin aspart for patients with type 2 diabetes not achieving glycemic control on basal insulin in the US. Therefore, IDegLira is likely to be considered dominant (cost saving and more effective) and, consequently, highly cost-effective in the US setting.","[Dempsey, Michael] Endocrine & Metab Consultants, Rockville, MD USA; [Mocarski, Michelle] Novo Nordisk Inc, Plainsboro, NJ USA; [Langer, Jakob] Novo Nordisk Pharma Ltd, Tokyo, Japan; [Hunt, Barnaby] Ossian Hlth Econ & Commun, Basel, Switzerland",Novo Nordisk; Novo Nordisk,"Hunt, B (通讯作者)，Ossian Hlth Econ & Commun GmbH, Baumleingasse 20, CH-4051 Basel, Switzerland.",hunt@ossianconsulting.com,"Dempsey, Michael/GSM-7774-2022",,Novo Nordisk A/S,Novo Nordisk A/S(Novo Nordisk),The present cost-effectiveness analysis was supported by funding from Novo Nordisk A/S.,,43,6,6,2,14,TAYLOR & FRANCIS LTD,ABINGDON,"2-4 PARK SQUARE, MILTON PARK, ABINGDON OR14 4RN, OXON, ENGLAND",1369-6998,1941-837X,,J MED ECON,J. Med. Econ.,NOV 2,2018,21,11.0,,,,,1110,1118,,10.1080/13696998.2018.1513406,0,,,9,"Economics; Health Care Sciences & Services; Health Policy & Services; Medicine, General & Internal",Science Citation Index Expanded (SCI-EXPANDED),Business & Economics; Health Care Sciences & Services; General & Internal Medicine,GX2YK,30114954.0,Bronze,,,2024-03-08,WOS:000447587100009,0
J,"Shahabi, M; Tafreshian, A; Unnikrishnan, A; Boyles, SD",,,,"Shahabi, Mehrdad; Tafreshian, Amirmahdi; Unnikrishnan, Avinash; Boyles, Stephen D.",,,Joint production-inventory-location problem with multi-variate normal demand,TRANSPORTATION RESEARCH PART B-METHODOLOGICAL,,,English,Article,,,,,,Joint production-Inventory-location; Supply chain network design; Outer approximation,INTEGER NONLINEAR PROGRAMS; CONTINUUM APPROXIMATION APPROACH; NETWORK DESIGN PROBLEM; SUPPLY CHAIN DESIGN; FACILITY DISRUPTIONS; OUTER-APPROXIMATION; DISTRIBUTION-SYSTEM; WAREHOUSE LOCATION; CORRELATED DEMANDS; SAFETY STOCK,"This paper develops a mixed integer nonlinear programming formulation for the production-inventory-location problem with correlated demands across the retailers. Several structural results for special cases of the problem are derived and studied. A solution method based on the outer approximation of the nonlinear terms is developed to solve the problem. The efficiency of the proposed model and solution approach is investigated through extensive numerical studies. Ignoring correlations can increase the total costs of a production-location-inventory system. Accounting for correlations may lead to changes in supply chain configuration. The effect of capacity on computational times was more pronounced in lower correlations than higher correlations. In addition, we show that the efficiency of the solution method increases significantly for two special cases - when all products have the same holding cost and when the number of orders for different products at each warehouse is constrained to be the same. (C) 2018 Elsevier Ltd. All rights reserved.","[Shahabi, Mehrdad; Tafreshian, Amirmahdi] Univ Michigan, Dept Civil & Environm Engn, 2350 Hayward,1036 GG Brown, Ann Arbor, MI 48109 USA; [Unnikrishnan, Avinash] Portland State Univ, Dept Civil & Environm Engn, Engn Bldg,301D,1930 SW 4th Ave, Portland, OR 97201 USA; [Boyles, Stephen D.] Univ Texas Austin, Dept Civil Architectural & Environm Engn, 301 E Dean Keeton St,Stop C1761, Austin, TX 78712 USA",University of Michigan System; University of Michigan; Portland State University; University of Texas System; University of Texas Austin,"Unnikrishnan, A (通讯作者)，Portland State Univ, Dept Civil & Environm Engn, Engn Bldg,301D,1930 SW 4th Ave, Portland, OR 97201 USA.",mshahabi@umich.edu; atafresh@umich.edu; uavinash@pdx.edu; sboyles@mail.utexas.edu,"Tafreshian, Amirmahdi/AAW-5747-2020","Tafreshian, Amirmahdi/0000-0003-1175-0707; Unnikrishnan, Avinash/0000-0001-6737-0485","National Science Foundation [1069141, 1157294, 1562109, 1562291]; Data-Supported Transportation Operations and Planning Tier 1 University Transportation Center; Directorate For Engineering [1069141] Funding Source: National Science Foundation; Directorate For Engineering; Div Of Civil, Mechanical, & Manufact Inn [1562109, 1157294] Funding Source: National Science Foundation; Div Of Civil, Mechanical, & Manufact Inn [1069141] Funding Source: National Science Foundation; Div Of Civil, Mechanical, & Manufact Inn; Directorate For Engineering [1562291] Funding Source: National Science Foundation","National Science Foundation(National Science Foundation (NSF)); Data-Supported Transportation Operations and Planning Tier 1 University Transportation Center; Directorate For Engineering(National Science Foundation (NSF)NSF - Directorate for Engineering (ENG)); Directorate For Engineering; Div Of Civil, Mechanical, & Manufact Inn(National Science Foundation (NSF)NSF - Directorate for Engineering (ENG)); Div Of Civil, Mechanical, & Manufact Inn(National Science Foundation (NSF)NSF - Directorate for Engineering (ENG)); Div Of Civil, Mechanical, & Manufact Inn; Directorate For Engineering(National Science Foundation (NSF)NSF - Directorate for Engineering (ENG))","The authors would also like to acknowledge the National Science Foundation for funding this work through Award Nos. 1069141 and 1157294 Collaborative Research: Stochastic and Dynamic Hyperpath Equilibrium Models and Award Nos. 1562109 and 1562291 Collaborative Research: Non-Additive Network Routing and Assignment Models. Partial support was also provided by the Data-Supported Transportation Operations and Planning Tier 1 University Transportation Center. Any error, mistake, or omission related to this research paper is the sole responsibility of the authors.",,45,16,17,4,47,PERGAMON-ELSEVIER SCIENCE LTD,OXFORD,"THE BOULEVARD, LANGFORD LANE, KIDLINGTON, OXFORD OX5 1GB, ENGLAND",0191-2615,,,TRANSPORT RES B-METH,Transp. Res. Pt. B-Methodol.,APR,2018,110,,,,,,60,78,,10.1016/j.trb.2018.02.002,0,,,19,"Economics; Engineering, Civil; Operations Research & Management Science; Transportation; Transportation Science & Technology",Science Citation Index Expanded (SCI-EXPANDED); Social Science Citation Index (SSCI),Business & Economics; Engineering; Operations Research & Management Science; Transportation,GC4MZ,,hybrid,,,2024-03-08,WOS:000429759900003,0
J,"Clark, R; Bozkaya, D; Levenberg, M; Faulkner, S; Smith, TW; Gerber, RA",,,,"Clark, Ryan; Bozkaya, Duygu; Levenberg, Mark; Faulkner, Steven; Smith, Timothy W.; Gerber, Robert A.",,,"Topical treatment utilization for patients with atopic dermatitis in the United States, and budget impact analysis of crisaborole ointment, 2%",JOURNAL OF MEDICAL ECONOMICS,,,English,Article,,,,,,Crisaborole; atopic dermatitis; topical treatment; cost; budget impact; topical corticosteroids; topical calcineurin inhibitors; treatment utilization,ECZEMA PREVALENCE; OPEN-LABEL; PHASE 2A; HEALTH; BURDEN; SAFETY; CARE; PIMECROLIMUS; ADULTS; ASSOCIATION,"Background: Atopic dermatitis (AD), a chronic inflammatory skin disease, is often treated with topical corticosteroids (TCS) and topical calcineurin inhibitors (TCI). Crisaborole ointment is a non-steroidal, phosphodiesterase 4 inhibitor for the treatment of mild-to-moderate AD. In December 2016, crisaborole was approved in the US for mild-to-moderate AD in patients >= 2 years of age. Aims: To evaluate real-world utilization and cost of TCS and TCI in the US and estimate the budget impact of crisaborole over 2 years from a third-party payer perspective. Methods: TCS and TCI prescriptions in 2015 for patients >= 2 years of age with >= 1 AD diagnosis in the Truven Health Analytics MarketScan Commercial and Medicare Supplemental Research Databases were analyzed for patients receiving TO or TCS alone or in combination (TCS/TCI population) and patients receiving TCI alone or in combination with TCS (TCI population). A budget impact model used TCS and TCI market shares, annual use, and cost per prescription. Crisaborole uptake rates of 4.7% (TCS) and 20.2% (TCI), with an annual increase of 1% in year 2, were assumed. Budget impact was calculated as total and per-member-per-month (PMPM) cost over 2 years for a health plan of 1 million members. Results: Annual prescriptions/patient ranged from 1.36-6.41; annual cost/patient was $53-$1,465. The budget impact of crisaborole over 2 years in the TCS/TCI population was $350,946 (PMPM, $0.015), with increases of $162,106 in year 1 (PMPM, $0.014) and $188,841 in year 2 (PMPM, $0.016). The budget impact in the TCI population was -$22,871, with decreases of $11,160 in year 1 and $11,712 in year 2 (each PMPM, -$0.001). For both populations, one-way sensitivity analyses showed that budget impact was most sensitive to changes in crisaborole cost and annual use. Conclusions: From US payer perspectives, adoption of crisaborole results in modest pharmacy budget impact/savings.","[Clark, Ryan; Bozkaya, Duygu] Xcenda LLC, 4114 Woodlands Pkwy,Suite 402, Palm Harbor, FL 34685 USA; [Levenberg, Mark] Pfizer Inc, Collegeville, PA USA; [Faulkner, Steven; Smith, Timothy W.] Pfizer Inc, New York, NY USA; [Gerber, Robert A.] Pfizer Inc, Groton, CT 06340 USA","AmerisourceBergen Corporation; Xcenda, LLC; Pfizer; Pfizer; Pfizer","Clark, R (通讯作者)，Xcenda LLC, 4114 Woodlands Pkwy,Suite 402, Palm Harbor, FL 34685 USA.",ryan.clark@xcenda.com,,,Pfizer Inc.,Pfizer Inc.(Pfizer),"This study was funded by Pfizer Inc., which manufactures crisaborole ointment, 2%.",,29,6,7,0,3,TAYLOR & FRANCIS LTD,ABINGDON,"2-4 PARK SQUARE, MILTON PARK, ABINGDON OR14 4RN, OXON, ENGLAND",1369-6998,1941-837X,,J MED ECON,J. Med. Econ.,,2018,21,8.0,,,,,770,777,,10.1080/13696998.2018.1470520,0,,,8,"Economics; Health Care Sciences & Services; Health Policy & Services; Medicine, General & Internal",Science Citation Index Expanded (SCI-EXPANDED),Business & Economics; Health Care Sciences & Services; General & Internal Medicine,GU8DK,29706103.0,Bronze,,,2024-03-08,WOS:000445564700005,0
J,"Yang, YD; Fan, YY; Wets, RJB",,,,"Yang, Yudi; Fan, Yueyue; Wets, Roger J. B.",,,Stochastic travel demand estimation: Improving network identifiability using multi-day observation sets,TRANSPORTATION RESEARCH PART B-METHODOLOGICAL,,,English,Article,,,,,,Stochastic O-D estimation; Traffic network; Domain knowledge; Identifiability,ORIGIN-DESTINATION MATRICES; LINK CHOICE PROPORTIONS; OBSERVABILITY PROBLEM; PROGRAMMING APPROACH; BAYESIAN-INFERENCE; TRAFFIC COUNTS; TRIP MATRICES; IDENTIFICATION; TOMOGRAPHY; PREDICTION,"Stochastic travel demand estimation is essential to support many resilience and reliability based transportation network analyses. The problem of estimating travel demand based on sensor data often results in an ill-posed inverse problem, where solution uniqueness cannot be ensured. To overcome this challenge, effective utilization of more information/data, preferably from reliable sources, becomes critical. Conventional demand estimation methods often sacrifice system structural information during the process of compressing sensor data into its statistics. Loss of structural information, which captures critical relation between observed and estimated parameters, inevitably causes more dependence on unrealistic assumptions and unreliable data. Our model is designed to preserve all structural information contained from different observation sets and allow it to directly contribute to the identification of population parameters of travel demand. The proposed hierarchical framework integrates two traditionally distinctive identification problems, mean demand estimation and trip table reconstruction. Through mathematical analyses and numerical experiments, we show that the proposed framework improves parameter identifiability and leads to better estimation quality compared to conventional methods. The proposed framework is also flexible to accommodate a wide variety of travel behavior assumptions and estimation principles. As an example among many possible alternatives, Wardrop equilibrium based traffic assignment and generalized least square are implemented and tested using a case study based on a moderately large network. (C) 2017 Elsevier Ltd. All rights reserved.","[Yang, Yudi; Fan, Yueyue] Univ Calif Davis, Dept Civil & Environm Engn, Davis, CA 95616 USA; [Wets, Roger J. B.] Univ Calif Davis, Dept Math, Davis, CA 95616 USA",University of California System; University of California Davis; University of California System; University of California Davis,"Fan, YY (通讯作者)，Univ Calif Davis, Dept Civil & Environm Engn, Davis, CA 95616 USA.",yyfan@ucdavis.edu,"Liu, Ying/ISU-1216-2023",,National Science Foundation of the United States [CMMI 1538263],National Science Foundation of the United States(National Science Foundation (NSF)),This research was supported by the National Science Foundation of the United States through grant CMMI 1538263.,,45,26,30,5,28,PERGAMON-ELSEVIER SCIENCE LTD,OXFORD,"THE BOULEVARD, LANGFORD LANE, KIDLINGTON, OXFORD OX5 1GB, ENGLAND",0191-2615,,,TRANSPORT RES B-METH,Transp. Res. Pt. B-Methodol.,JAN,2018,107,,,,,,192,211,,10.1016/j.trb.2017.10.007,0,,,20,"Economics; Engineering, Civil; Operations Research & Management Science; Transportation; Transportation Science & Technology",Science Citation Index Expanded (SCI-EXPANDED); Social Science Citation Index (SSCI),Business & Economics; Engineering; Operations Research & Management Science; Transportation,FV1IN,,hybrid,,,2024-03-08,WOS:000424314900010,0
J,"Abhulimen, S; Hirsch, A",,,,"Abhulimen, Sese; Hirsch, Abigail",,,Quantifying the economic impact of a digital self-care behavioral health platform on Missouri Medicaid expenditures,JOURNAL OF MEDICAL ECONOMICS,,,English,Article,,,,,,Depression; digital behavioral health; claims; health care cost; population health; return on investment,RANDOMIZED CONTROLLED-TRIALS; MENTAL-HEALTH; INTERVENTIONS; METAANALYSIS; DEPRESSION; COST; SYMPTOMS; EFFICACY; DISORDER; SERVICES,"Aim: The primary objective of this study is to estimate the economic benefits relative to return on investment (ROI) of a state-wide initiative to integrate digital behavioral health (BH) self-care into the community BH system. Methods: The observational study reviewed claims data of 799 people who registered with the digital tool (myStrength) and 715 matched control study participants. The control group was formed via coarsened exact match with blocking variables, including presence on the claims file, volume of health care utilization, participation in a medical health home, BH diagnosis and volume of psychotherapy claims. The primary study analysis of cost differences for the BH self-care tool group versus the control group were calculated by cost setting and the ROI of the BH self-care tool was estimated. Cost settings assessed include inpatient, emergency services, general and psychiatric outpatient, and outpatient psychotherapy. Results: An incremental annual difference in difference reduction of $382 per user was observed over the 11 month study period in the self-care tool group. Sensitivity analysis indicated an ROI of between 142% and 695%. Conclusions: Augmenting BH offerings to include digital BH self-care tools appears to generate positive ROI via reduced total cost of care.","[Abhulimen, Sese] Propensity4, Berwyn, PA USA; [Hirsch, Abigail] myStrength Inc, 1875 Lawrence St,Suite 550, Denver, CO 80202 USA",,"Hirsch, A (通讯作者)，myStrength Inc, 1875 Lawrence St,Suite 550, Denver, CO 80202 USA.",ahirsch@mystrength.com,,,myStrength Inc.; Missouri Health Foundation,myStrength Inc.; Missouri Health Foundation,This research was funded by myStrength Inc. and the Missouri Health Foundation.,,30,4,4,1,11,TAYLOR & FRANCIS LTD,ABINGDON,"2-4 PARK SQUARE, MILTON PARK, ABINGDON OR14 4RN, OXON, ENGLAND",1369-6998,1941-837X,,J MED ECON,J. Med. Econ.,NOV 2,2018,21,11.0,,,,,1084,1090,,10.1080/13696998.2018.1510834,0,,,7,"Economics; Health Care Sciences & Services; Health Policy & Services; Medicine, General & Internal",Science Citation Index Expanded (SCI-EXPANDED); Social Science Citation Index (SSCI),Business & Economics; Health Care Sciences & Services; General & Internal Medicine,GX2YK,30095023.0,Bronze,,,2024-03-08,WOS:000447587100005,0
J,"Bunniran, S; Lee, E; Kamble, P; Suehs, B; Franks, B; Schwartz, J; Thal, G; Spalding, J",,,,"Bunniran, Suvapun; Lee, Edward; Kamble, Pravin; Suehs, Brandon; Franks, Billy; Schwartz, Jason; Thal, Gary; Spalding, James",,,Healthcare utilization and costs with fixed-source versus variable-source tacrolimus in patients receiving a kidney transplant,JOURNAL OF MEDICAL ECONOMICS,,,English,Article,,,,,,Tacrolimus; switching; kidney transplant treatment patterns; manufacturer switching; brand and generic switching,GENERIC TACROLIMUS; EPIDEMIOLOGIC RESEARCH; BRAND-NAME; DATABASES; FORMULATION; CONVERSION; RECIPIENTS; WARFARIN; OUTCOMES; DRUGS,"Aims: Switching drug manufacturers in transplant patients may require an increased intensity of therapeutic monitoring, leading to additional healthcare visits, associated laboratory tests, and perhaps hospitalizations. As real-world studies examining the interchangeability of tacrolimus from different manufacturers are limited, the purpose of this study was to examine the healthcare resource utilization (HRU) and economic impact of tacrolimus-switching in kidney transplantation. Materials and methods: This cross-sectional, retrospective study examined HRU and healthcare costs (HCCs) among patients with a kidney transplant who were prescribed tacrolimus from fixed-source (FS) vs variable-source (VS) manufacturers using claims data from the large US health plan Humana from October 1, 2012, to December 31, 2013. Results: Overall, 1,024 patients were identified (FS: n = 674, 66%; VS: n = 350, 34%). The number of therapeutic drug monitoring (TDM) events for the VS group was 13% greater than for the FS group after controlling for demographics, comorbidity score, and number of medications (incidence rate ratio = 1.13, p = .033). Adjusted total HCCs were 9% lower for VS (US$28,054 vs US$30,823, p = .045). In the unadjusted analysis, VS had greater emergency department (ED) utilization (45% vs 35%, p < .002). In the VS group, the mean (standard deviation [SD]) number of days from manufacturer switch to first outpatient visit was 23.8 (33.6), and the number of days (SD) to first TDM event was 43.6 (56.2). Limitations: Study limitations include the lack of availability of many transplant-specific variables within the Humana database, potential errors/omissions in claims coding, and restriction of cross-sectional data examination to a 1-year period. Conclusions: VS patients had greater TDM and lower total HCCs. Further research is warranted to understand the drivers of ED use among the VS group, and to determine factors associated with delayed TDM after regimen modification. Opportunities may exist to improve the quality of care for patients receiving immunosuppressant treatment with tacrolimus.","[Bunniran, Suvapun; Kamble, Pravin; Suehs, Brandon] Humana Inc, Comprehens Hlth Insights, Louisville, KY USA; [Lee, Edward; Schwartz, Jason; Thal, Gary; Spalding, James] Astellas Pharma Global Dev Inc, Med Affairs, Northbrook, IL USA; [Franks, Billy] Astellas Pharma Global Dev Inc, Real World Informat, Leiden, Netherlands",Humana Inc.; Astellas Pharmaceuticals; Astellas Pharmaceuticals,"Bunniran, S (通讯作者)，Comprehens Hlth Insights, Humana Bldg,515 West Market St, Louisville, KY 40202 USA.",sbunniran@humana.com,,,"Astellas Pharma Global Development, Inc.","Astellas Pharma Global Development, Inc.","This study was funded by Astellas Pharma Global Development, Inc.",,25,0,0,0,3,TAYLOR & FRANCIS LTD,ABINGDON,"2-4 PARK SQUARE, MILTON PARK, ABINGDON OR14 4RN, OXON, ENGLAND",1369-6998,1941-837X,,J MED ECON,J. Med. Econ.,NOV 2,2018,21,11.0,,,,,1067,1074,,10.1080/13696998.2018.1503596,0,,,8,"Economics; Health Care Sciences & Services; Health Policy & Services; Medicine, General & Internal",Science Citation Index Expanded (SCI-EXPANDED),Business & Economics; Health Care Sciences & Services; General & Internal Medicine,GX2YK,30032686.0,Bronze,,,2024-03-08,WOS:000447587100003,0
